id,created_at,text
1213356889670483968,2020-01-04 07:10:00,"b'Law made injustice possible in Ayodhya, Hyderabad encounter cases. Will this happen with CAA too?\xe2\x80\xa6 https://t.co/6iP9lyLrsL'"
1213351856438571009,2020-01-04 06:50:00,"b'Watch: A decade of LGBTQ+ representation in American cinema and TV, captured in 140 seconds https://t.co/BdghbOw3BC\xe2\x80\xa6 https://t.co/GWJxp6FF3w'"
1213346823206772737,2020-01-04 06:30:00,"b'Constitution draft was prepared by a Brahmin,  claims Gujarat Speaker https://t.co/gcpc7U699r'"
1213341790046044165,2020-01-04 06:10:00,"b'Watch: Tiger mauls tigress to death in horrifying incident at Sajjangarh Biological Park, Udaipur https://t.co/sN2yAvdEka'"
1213336756902408193,2020-01-04 05:50:00,b'.@deepikapadukone on \xe2\x80\x98Chhapaak\xe2\x80\x99: \xe2\x80\x98This was my most physically challenging film\xe2\x80\x99 https://t.co/djQY3RRN8j https://t.co/l5nd4KMOdA'
1213331723683057664,2020-01-04 05:30:00,b'Video games are becoming a legitimate sport. Can India keep up? https://t.co/6G8F5bjgoH \n\nThe 2018 Asian Games incl\xe2\x80\xa6 https://t.co/V2uQmJHq1Y'
1213330859433947136,2020-01-04 05:26:34,"b'RT @thefield_in: #TableTennis\n\nPhysical and mental training in India, basic techniques in Germany, Japan for sharpening speed and reactions\xe2\x80\xa6'"
1213330321740947456,2020-01-04 05:24:25,"b'Iranian general killed in US airstrike was behind \xe2\x80\x98terror plots as far as Delhi\xe2\x80\x99, claims Trump\xe2\x80\xa6 https://t.co/6lz7leqQaR'"
1213329006155579394,2020-01-04 05:19:12,"b'RT @thefield_in: ICYMI\n\nIf Manjot Kalra, the player of the match in the final, is guilty of age fraud, should India still be the Under-19 W\xe2\x80\xa6'"
1213326690618724353,2020-01-04 05:10:00,b'A look at the headlines right now. https://t.co/XPwB6oGzyG'
1213321657399566336,2020-01-04 04:50:00,b'What Bhisham Sahni\xe2\x80\x99s \xe2\x80\x98Madhavi\xe2\x80\x99 tells us about female agency (or the lack of it) in the Mahabharata\xe2\x80\xa6 https://t.co/pMUJTtysru'
1213316625031729152,2020-01-04 04:30:00,"b'Nankana Sahib gurdwara not vandalised, claims Pakistan, says shrine is \xe2\x80\x98untouched and undamaged\xe2\x80\x99 https://t.co/aM8ryQE5lU'"
1213311591292252160,2020-01-04 04:10:00,b'View from Bangladesh: India is using its neighbours as scare objects to spread the politics of hate\xe2\x80\xa6 https://t.co/itHx1otYEN'
1213308453948706816,2020-01-04 03:57:32,"b'RT @thefield_in: #eSports \n\nAt 264 million, India has the second-highest number of mobile gamers after China.\n\nhttps://t.co/gCJblrQb0B'"
1213306558144221189,2020-01-04 03:50:00,"b'Listen: Tappas in Bhairavi sung by Siddheshwari Devi, Sharad Sathi and other greats https://t.co/XXgubSkBbX https://t.co/GATuhSI7yH'"
1213304952799416320,2020-01-04 03:43:37,b'Attacks and apathy: Two cases from Firozabad illustrate how the UP police have treated Muslims\xe2\x80\xa6 https://t.co/jO3uEGcSHV'
1213302999000305664,2020-01-04 03:35:51,b'At least six killed as US targets pro-Iran militia near Baghdad: Reports https://t.co/siOWJ8x60M \n\nThis came hours\xe2\x80\xa6 https://t.co/T7Eggw3P6w'
1213302119895203840,2020-01-04 03:32:22,"b'Charged with aiding Maoist ambush, Bastar journalist is acquitted four years later https://t.co/QreHFT6W0q \n\nSantos\xe2\x80\xa6 https://t.co/dytXaQbke8'"
1213291458465124352,2020-01-04 02:50:00,b'The second wave of sexual technologies is here \xe2\x80\x93 and it\xe2\x80\x99s redefining how people experience pleasure\nhttps://t.co/jC7Y8ThHmP'
1213286425178730496,2020-01-04 02:30:00,b'An external shock \xe2\x80\x93 in the form of high oil prices or a drop in remittances from the Indians who live in West Asia\xe2\x80\xa6 https://t.co/r690KaOoTU'
1213281392206995457,2020-01-04 02:10:00,b'There is no doubt about it: 2019 was a terrible year for the Indian economy. https://t.co/rMWTHgU3YS'
1213276358857637888,2020-01-04 01:50:00,b'The Indian Constitution does not allow states to undermine the executive power of the Centre. But states not wantin\xe2\x80\xa6 https://t.co/My9sCJscLR'
1213271325772566530,2020-01-04 01:30:00,"b'""People don\xe2\x80\x99t have jobs, shops are closing down, the economy is in a bad state... what is the need for this law?"" https://t.co/pxHZmQqwXP'"
1213266292712435713,2020-01-04 01:10:00,"b'Even considering that Afghanistan, Pakistan and Bangladesh discriminate against their minorities, why should a matu\xe2\x80\xa6 https://t.co/RJvggDLfZp'"
1213261259430219776,2020-01-04 00:50:00,"b'After five months, here is how life has changed for three residents of the Valley. https://t.co/VUNchKxWkJ'"
1213256226236092416,2020-01-04 00:30:00,"b'Imran Khan tweets old video from Bangladesh, says it shows police brutality in India https://t.co/MGmkE1kZPm'"
1213248678321889282,2020-01-04 00:00:00,"b'Hema Malini, Rajkummar Rao and Rakul Preet Singh star in Ramesh Sippy\xe2\x80\x99s first film in 25 years. https://t.co/nJQyTOtStX'"
1213241126821478402,2020-01-03 23:30:00,b'\xe2\x80\x98Never underestimate the power of Faiz\xe2\x80\x99: Poet\xe2\x80\x99s daughter responds to IIT-Kanpur controversy https://t.co/VB748HJB4R'
1213233580005965824,2020-01-03 23:00:00,b'Watch: Spirited New Year wishes from a Delhi government school\xe2\x80\x99s students in 18 Indian languages https://t.co/7EDzZ6Y8f4'
1213226027880718352,2020-01-03 22:30:00,"b'We will not determine if Faiz\xe2\x80\x99s poem \xe2\x80\x98Hum Dekhenge\xe2\x80\x99 is anti-Hindu, clarifies IIT-Kanpur https://t.co/HX3NGlwdWd'"
1213218479022727173,2020-01-03 22:00:00,b'\xe2\x80\x98Cats\xe2\x80\x99 movie review: A purr-fect disaster https://t.co/myTi4jpsvU (via @TheReel_in) \n\n#CatsReview https://t.co/YAu0f2fd2k'
1213210928386174976,2020-01-03 21:30:00,"b'There was a time when virginity was a disease, and sex (preferably marital) was the only lasting solution.\xe2\x80\xa6 https://t.co/2qQtJ7UnrC'"
1213203379998134272,2020-01-03 21:00:00,b'Pop culture depicts war as a sequence of battles culminating in a decisive set-piece clash. History is more complex. https://t.co/Fo7juSfYPi'
1213195828677890048,2020-01-03 20:30:00,b'ISL: Sunil Chhetri\xe2\x80\x99s brace sinks FC Goa as Bengaluru FC close the gap at the top\nhttps://t.co/s3mRCxWqmG (via @thefield_in)'
1213188280218308610,2020-01-03 20:00:00,"b'From \xe2\x80\x98Paree Hoon Main\xe2\x80\x99 to \xe2\x80\x98Purani Jeans\xe2\x80\x99 via \xe2\x80\x98Made in India\xe2\x80\x99 and \xe2\x80\x98Tanha Dil\xe2\x80\x99, it\xe2\x80\x99s all here. https://t.co/hVGqVKsKPG (via @TheReel_in)'"
1213180728994942978,2020-01-03 19:30:00,"b'On CAA and Article 370, former NSA Shivshankar Menon warns India of international isolation https://t.co/XXlMiGEDq5'"
1213174606271397888,2020-01-03 19:05:40,b'RT @TheReel_in: #Hunters trailer: Al Pacino heads a team of Nazi slayers in new Amazon Studios series\nhttps://t.co/WShUknQ9Lj'
1213173181290336259,2020-01-03 19:00:00,b'#DataCheck: Liverpool\xe2\x80\x99s year-long unbeaten run and how it compares with other similar streaks https://t.co/BPY5Idt13h (via @thefield_in)'
1213165629617799173,2020-01-03 18:30:00,b'Pakistani authorities are struggling to protect the crumbling ancestral homes of the Kapoor dynasty and Dilip Kumar\xe2\x80\xa6 https://t.co/AfjcTP2Kw5'
1213163112922148865,2020-01-03 18:20:00,b'Union minister lied to Parliament about effect of curbs on J&amp;K tourism: The Wire https://t.co/boToSMu38D'
1213160596360900609,2020-01-03 18:10:00,b'Watch: Spirited New Year wishes from a Delhi government school\xe2\x80\x99s students in 18 Indian languages https://t.co/7EDzZ7fJDE'
1213155562986209280,2020-01-03 17:50:00,"b'Don\xe2\x80\x99t believe the movies. In modern warfare, victory is a myth\nhttps://t.co/Fo7juRYnqI'"
1213152732619476992,2020-01-03 17:38:45,"b'Imran Khan tweets old video from Bangladesh, says it shows police brutality in India\nhttps://t.co/MGmkE1kZPm'"
1213152173921464320,2020-01-03 17:36:32,"b'\xe2\x80\x98You are a minority, live according to our customs\xe2\x80\x99: Karnataka BJP MLA warns CAA, NRC protestors\nhttps://t.co/WUp5elhPwW'"
1213150530605920257,2020-01-03 17:30:00,b'Watch: What is Faiz Ahmed Faiz\xe2\x80\x99s \xe2\x80\x98Hum Dekhenge\xe2\x80\x99 about? This translation helps understand https://t.co/1543zqW3IH'
1213145496795021312,2020-01-03 17:10:00,b'Movie Review | \xe2\x80\x98Bombshell\xe2\x80\x99 https://t.co/bcpjsH5olz (via @TheReel_in)'
1213140463848493057,2020-01-03 16:50:00,"b'In Odisha, a coal mining project has undone years of tree-conservation efforts in one fell swoop\nhttps://t.co/ikE9MmWAjJ'"
1213135430692089858,2020-01-03 16:30:00,b'Video games are becoming a legitimate sport. Can India keep up? https://t.co/DNE14ACJ59'
1213134728695468032,2020-01-03 16:27:12,"b'Nankana Sahib vandalism: India condemns incident, asks Pakistan to protect Sikh community\nhttps://t.co/Fuuef0HTYS'"
1213131740794912769,2020-01-03 16:15:20,"b'A government employee in Kargil said around 1,000 people attended the protest, chanting slogans against the United\xe2\x80\xa6 https://t.co/hbmOVKSVAv'"
1213131429036511232,2020-01-03 16:14:06,b'Kargil: Shia groups hold protest rally against killing of Iranian military officer by US https://t.co/aBBoDllERb'
1213130397468356608,2020-01-03 16:10:00,b'\xe2\x80\x98OK Boomer\xe2\x80\x99 and \xe2\x80\x98TyPiNg LiKe ThIs\xe2\x80\x99: Language trends that defined the internet in 2019 https://t.co/ryy3aO1Svr'
1213126774579580928,2020-01-03 15:55:36,"b""RT @thefield_in: FT: BEN 2-1 GOA\n\nChhetri brace seals the win for Bengaluru FC who cut FC Goa's lead to two points. Huge win for the champi\xe2\x80\xa6"""
1213126072889274368,2020-01-03 15:52:49,b'Take a look at the biggest stories of the day.  https://t.co/OyvDiiK3km'
1213125364202868736,2020-01-03 15:50:00,"b'Assassinated Iranian military officer was responsible for millions of deaths, claims Donald Trump\nhttps://t.co/IS6XBsuIzF'"
1213122564471447552,2020-01-03 15:38:52,"b'\xe2\x80\x98Need to protect democracy\xe2\x80\x99: Kerala\xe2\x80\x99s Pinarayi Vijayan writes to 11 CMs, urges them to oppose CAA https://t.co/GW3guzzhPM'"
1213120331281506310,2020-01-03 15:30:00,b'2020 should be the year Modi and Shah focus all efforts on the economy. Will they? https://t.co/rMWTHgU3YS | @RohanV https://t.co/A80z4vwWul'
1213117216113119232,2020-01-03 15:17:37,b'Join the #ScrollFood community on:\n\nFacebook: https://t.co/5UfvBlPMN6\nInstagram: https://t.co/Rywo1GVrTH https://t.co/o7qLKDhpnm'
1213117203760893952,2020-01-03 15:17:34,b'Follow these steps to contribute to #ScrollFood.\nhttps://t.co/twO9F6pKUW'
1213117199235239936,2020-01-03 15:17:33,b'#ScrollFood | We are building the biggest encyclopedia of recipes in India. Be a part of our journey. https://t.co/riocwRKtcx'
1213117195590328320,2020-01-03 15:17:32,"b'Spiced Baked Peaches, Almond Crumble And Mishti Doi: #ScrollFood recipe by @shaunkenworthy https://t.co/CGpkc4S9Ph\xe2\x80\xa6 https://t.co/nJM39RFlzR'"
1213115298037059586,2020-01-03 15:10:00,"b'Millions of Indians live in the region. Their lives, and livelihoods, would be in danger. https://t.co/QOL2sz7OvY'"
1213112672239026178,2020-01-03 14:59:34,"b'RT @thefield_in: #ISL #IndianFootball\n\n""I can score fewer goals but if we finish champions, I\xe2\x80\x99ll be the happiest.""\n\n@papesougou is happy pl\xe2\x80\xa6'"
1213112200769855490,2020-01-03 14:57:41,"b'#Mangaluru: Sedition cases filed, two arrested for \xe2\x80\x98inflammatory\xe2\x80\x99 social media posts\nhttps://t.co/yIsgAKtJJO'"
1213110349689311233,2020-01-03 14:50:20,b'RT @thefield_in: HT: BEN 0-0 GOA\n\nNothing to separate the two teams at the break. Both teams with a few half-chances. A big second-half to\xe2\x80\xa6'
1213110264587051008,2020-01-03 14:50:00,"b'Pragmatism, Marxism, and a Western orientation: The three nodes of the Progressive Writers\xe2\x80\x99 Movement https://t.co/B4mW9SGonN'"
1213105232051228672,2020-01-03 14:30:00,b'Watch: Thousands flee their homes as Australia bushfires move towards the east coast https://t.co/R2S9TeeBzV'
1213104739455422472,2020-01-03 14:28:02,b'RT @thefield_in: #Wrestling \n\nJitender will represent India at the Asian Championships in a category that is going to be keenly watched.\n\nR\xe2\x80\xa6'
1213104423037067265,2020-01-03 14:26:47,"b'On #CAA and #Article370, former NSA Shivshankar Menon warns India of international isolation\nhttps://t.co/XXlMiGn21v'"
1213100198315970562,2020-01-03 14:10:00,b'\xe2\x80\x98Sab Kushal Mangal\xe2\x80\x99 movie review: Akshaye Khanna is the best thing about groom kidnapping comedy https://t.co/s0erFAQTVh'
1213098929866170369,2020-01-03 14:04:57,"b'Also read,\n\nHere\xe2\x80\x99s what an Iran-US conflict would mean for India https://t.co/QOL2syQd7o\n\nMillions of Indians live\xe2\x80\xa6 https://t.co/yIs8HTYAna'"
1213098689687744513,2020-01-03 14:04:00,"b'India urges restraint, de-escalation after US strike kills top Iranian military general\nhttps://t.co/R99arZQEnf'"
1213095165159788545,2020-01-03 13:50:00,b'Nathuram Godse and Narayan Apte were the first convicts to be hanged in independent India https://t.co/s3sj9AVRf8'
1213092655820787712,2020-01-03 13:40:01,b'Iran: Ayatollah Khamenei appoints successor of top general killed in US airstrike https://t.co/ZbtihFeCOE'
1213092509749899264,2020-01-03 13:39:27,b'RT @thefield_in: BIG GAME ALERT\n\nThe first #ISL game of 2020 is an absolute cracker\n\n@bengalurufc hosts league leaders @FCGoaOfficial in a\xe2\x80\xa6'
1213090582135894016,2020-01-03 13:31:47,"b""RT @thefield_in: #ICYMI: \n\nShubman Gill involved in a controversy during Punjab's match against Delhi which is now being underplayed by bot\xe2\x80\xa6"""
1213090132233994240,2020-01-03 13:30:00,"b'\xe2\x80\x9cIs it wrong to draw kolams?\xe2\x80\x9d \n\nIn Tamil Nadu, protest kolams embody fiercely regional pride\xe2\x80\xa6 https://t.co/OMfhKwOhnE'"
1213088714940809218,2020-01-03 13:24:22,"b'#CAAProtests: Over 60 people detained in #Vadodara, large demonstrations held in #Bengaluru\nhttps://t.co/TRLb4yQoje'"
1213087468813045760,2020-01-03 13:19:25,"b""RT @thefield_in: #PremierLeague #Liverpool \n\n365 days unbeaten and counting for Jurgen Klopp's rampaging Reds.\n\nHere are numbers behind thi\xe2\x80\xa6"""
1213085098960130052,2020-01-03 13:10:00,"b'\xe2\x80\x98Hindus from Pakistan can stay, Hindus from India without papers have to leave\xe2\x80\x99: Arvind Kejriwal\nhttps://t.co/pxHZmQqwXP'"
1213080065677742080,2020-01-03 12:50:00,b'The weird history of beds reveals how pillow talk has changed over the ages https://t.co/7zBhAAarcM'
1213079655646806016,2020-01-03 12:48:22,"b'#CAAProtests: Bail granted to activist #SadafJafar and retired IPS officer SR Darapuri, say reports\nhttps://t.co/Zqsr3LaJHz'"
1213079395457306626,2020-01-03 12:47:20,"b'RT @thefield_in: #RanjiTrophy \n\nMumbai are in trouble yet again, Shubman Gill involved in a controversy.\n\nRead: \n\nhttps://t.co/HuQpuBY9Vj'"
1213079010411827201,2020-01-03 12:45:48,b'RT @thefield_in: #Wrestling \n\nWrestling trials: Jitender emerges on top in 74kg to put Sushil Kumar\xe2\x80\x99s Olympic dream in danger\n\nReport by @s\xe2\x80\xa6'
1213077549112274953,2020-01-03 12:40:00,b'Here\xe2\x80\x99s what an #Iran -US conflict would mean for India https://t.co/QOL2sz7OvY | @RohanV'
1213075398830911488,2020-01-03 12:31:27,"b""RT @thefield_in: #ISL \n\nActiion in @IndSuperLeague starts off in the new year with a cracking fixture.\n\nA rematch of last edition's final.\xe2\x80\xa6"""
1213075033230200832,2020-01-03 12:30:00,"b'In Tripura, a tribal man on his way to CAA protests was allegedly beaten to death by a mob https://t.co/wmEky5BCmg | @makesyoucakes'"
1213071124772212736,2020-01-03 12:14:28,"b'RT @thefield_in: #TableTennis  \n\nWhat a start to the new year. Congratulations, Manav Thakkar! \n\nREAD: https://t.co/7EzZZgXAJk'"
1213069999104913408,2020-01-03 12:10:00,b'\xe2\x80\x98They\xe2\x80\x99re scared that they don\xe2\x80\x99t scare us\xe2\x80\x99: This song is dedicated to \xe2\x80\x98protesting Indian students\xe2\x80\x99 https://t.co/d3XNr2aLLy'
1213067485731336192,2020-01-03 12:00:00,b'Watch: @Javedakhtarjadu explains why objecting to Faiz\xe2\x80\x99s \xe2\x80\x98Hum Dekhenge\xe2\x80\x99 is laughable https://t.co/jqCAH6iPfr'
1213064965994635264,2020-01-03 11:50:00,b'The government seems to think it can put off dealing with the economy to a later date. Things don\xe2\x80\x99t work like that. https://t.co/rMWTHgCsAi'
1213064823618953217,2020-01-03 11:49:26,"b'RT @thefield_in: \xe2\x80\x9cI am ready, I feel more than alive""\n\nWill #ZlatanIbrahimovic be able to revive AC Milan\'s fortunes? \n\nREAD: https://t.co/\xe2\x80\xa6'"
1213062621923987457,2020-01-03 11:40:41,b'RT @thefield_in: #IndianTennis #AustraliaBushfires\n\nRaging bushfires forced the Canberra International tennis tournaments to be relocated\xe2\x80\xa6'
1213059932750114817,2020-01-03 11:30:00,b'The Indian Constitution does not allow states to undermine the executive power of the Centre. But states not wantin\xe2\x80\xa6 https://t.co/8kKGfNQaqY'
1213057779700621313,2020-01-03 11:21:26,"b'Even considering that Afghanistan, Pakistan and Bangladesh discriminate against their minorities, why should a matu\xe2\x80\xa6 https://t.co/532VBAz8K6'"
1213057751091314688,2020-01-03 11:21:20,"b'RT @thefield_in: #IndianFootball \n\n\xe2\x80\x9cI understand that I don\xe2\x80\x99t have many games left to play for my country"": Sunil Chhetri\n\nREAD: https://t.\xe2\x80\xa6'"
1213055990356172802,2020-01-03 11:14:20,"b'#CAAProtests: Centre\xe2\x80\x99s next step will be to deport Rohingya Muslims, says Union minister\nhttps://t.co/FnY5gGuPsV'"
1213054899782660096,2020-01-03 11:10:00,"b""To Jyotiba, from Savitribai Phule: These aren't love letters, but tell you what love is all about\xe2\x80\xa6 https://t.co/816Co4WRwq"""
1213052159547211777,2020-01-03 10:59:06,b'RT @thefield_in: No more football during warm-ups for England cricket team. Right move? \n\nREAD: https://t.co/l718l25wiz'
1213051466379694081,2020-01-03 10:56:21,b'CAA: Amit Shah says Centre will \xe2\x80\x98not move back an inch\xe2\x80\x99 even if all parties unite against law\nhttps://t.co/BmrN5baYC1 \n\n#CAA_NRC_Protests'
1213049866475233291,2020-01-03 10:50:00,b'Caught on TV: Javed Akhtar scolds Aaj Tak news anchor for what he sees as bias in her questions https://t.co/phtSqUzi9q'
1213046225466880001,2020-01-03 10:35:32,b'#CAAProtests: \xe2\x80\x98Are you India\xe2\x80\x99s prime minister or envoy of Pakistan?\xe2\x80\x99 Mamata Banerjee asks Modi\nhttps://t.co/eDJ6ZW2nrA'
1213044833645842432,2020-01-03 10:30:00,b'How do Crazy Rich Indians holiday? They rent Ronaldo\xe2\x80\x99s yacht or ask Coldplay to sing their playlist\xe2\x80\xa6 https://t.co/N6hIbDVj3C'
1213043483222499328,2020-01-03 10:24:38,b'RT @thefield_in: #IndianBadminton #Olympics\n\nLondon 2012: One bronze\n\nRio 2016: One silver\n\n#Tokyo2020: ?? \n\nRead: https://t.co/kGBSoExTa6'
1213039800162250752,2020-01-03 10:10:00,b'State of surveillance: TikTok received the highest number of user information requests from India\xe2\x80\xa6 https://t.co/4uJGm8wydz'
1213038404612444160,2020-01-03 10:04:27,"b'Also read,\n\nWhat happened at the board meeting where Cyrus Mistry had to quit as Tata Sons chairman https://t.co/5nEDnPMkYL'"
1213037920874946563,2020-01-03 10:02:32,b'Ratan Tata moves Supreme Court challenging Cyrus Mistry\xe2\x80\x99s reinstatement https://t.co/5gEnfQUmVw'
1213037052486250496,2020-01-03 09:59:05,"b""To Jyotiba, from #SavitribaiPhule: These aren't love letters, but tell you what love is all about https://t.co/3dM8P3MXXk [Replug]"""
1213034767144370177,2020-01-03 09:50:00,b'Anti-NRC pamphlet: Uttar Pradesh police charge three activists with hurting national integration\xe2\x80\xa6 https://t.co/UCI35r4ZAb'
1213032174976258049,2020-01-03 09:39:42,b'RT @thefield_in: The opening day of the #RanjiTrophy match between Punjab and Delhi faced a stoppage of about ten minutes due to the incide\xe2\x80\xa6'
1213032133268103173,2020-01-03 09:39:32,"b'We will not determine if Faiz\xe2\x80\x99s poem \xe2\x80\x98Hum Dekhenge\xe2\x80\x99 is anti-Hindu, clarifies IIT-Kanpur\n\xc2\xa0https://t.co/HX3NGlNONL https://t.co/9uiJkLchvd'"
1213030465239576576,2020-01-03 09:32:54,"b'RT @thefield_in: #IndianFootball \n\n""The belief in the squad is unmistakable"": @chetrisunil11 \n\nREAD: https://t.co/H7KV9gFGp8'"
1213029734457589760,2020-01-03 09:30:00,"b'#FaizAhmedFaiz: Pakistan\xe2\x80\x99s symbol of revolution is today a universal symbol of peace, democracy\xe2\x80\xa6 https://t.co/D8FRIXh9ym'"
1213025615416193025,2020-01-03 09:13:38,b'RT @thefield_in: Jason Gillespie talks about his interactions with Ishant Sharma as a coach. \n\nREAD: https://t.co/gleCSZfEsT'
1213024700684595201,2020-01-03 09:10:00,b'#GhostStories review: No chills in Netflix anthology horror film https://t.co/YWq3Du5ygy (via @TheReel_in) https://t.co/UKIAiRxXz3'
1213023202764439552,2020-01-03 09:04:03,"b'J&amp;K: No one called three former chief ministers in detention \xe2\x80\x98anti national\xe2\x80\x99, says Amit Shah https://t.co/BbySdpQ6Km https://t.co/MmoMSBgHEh'"
1213019667637260290,2020-01-03 08:50:00,"b'The Art of Resistance: In Tamil Nadu, protest kolams embody fiercely regional pride https://t.co/8L7ujjACq1 https://t.co/sJmpjOwGrR'"
1213017496552271872,2020-01-03 08:41:22,b'Delhi gets marginal respite from severe cold and air pollution https://t.co/cMaK5p0Wzq https://t.co/pJnHfwITXb'
1213014634829139968,2020-01-03 08:30:00,"b'Nick Kyrgios, Chris Lynn lead charge as tennis and cricket players support Australia bushfire relief\xe2\x80\xa6 https://t.co/LvFFhP7wgb'"
1213011905230471169,2020-01-03 08:19:09,"b'Union minister lied to Parliament about effect of curbs on J&amp;K tourism, say RTI activists: The Wire\xe2\x80\xa6 https://t.co/oFpaHNGn7r'"
1213004568063332352,2020-01-03 07:50:00,b'Watch: Thousands flee their homes as Australia bushfires move towards the east coast https://t.co/R2S9TdX0In'
1213002051350745090,2020-01-03 07:40:00,"b'Now, Kerala\xe2\x80\x99s Republic Day tableau proposal rejected, minister calls it politically motivated\xe2\x80\xa6 https://t.co/qzqDRVImtA'"
1213000557356449793,2020-01-03 07:34:03,b'Anti-NRC pamphlet: Uttar Pradesh police charge three activists with hurting national integration\xe2\x80\xa6 https://t.co/fUEwCjTAzR'
1212999534885949441,2020-01-03 07:30:00,b'Watch: Fishermen draped in blankets try to catch fish on a frozen Anchaar Lake in Srinagar https://t.co/6SVMT9TfFh'
1212995794539646976,2020-01-03 07:15:08,"b'RT @thefield_in: #IndianFootball #ISL\n\n""I\xe2\x80\x99ve come here to India for an experience and I\xe2\x80\x99m getting it 100%""\n\nAn interview with @HydFCOfficia\xe2\x80\xa6'"
1212994501582544896,2020-01-03 07:10:00,b'Movie review: #Cats\n\nhttps://t.co/myTi4jH3ns\n\nA purr-fect disaster https://t.co/PXwIS7reuF'
1212991985381990400,2020-01-03 07:00:00,b'Activist Sadaf Jafar\xe2\x80\x99s arrest: Allahabad HC seeks UP government\xe2\x80\x99s reply on quashing of FIR https://t.co/bkuglB588p https://t.co/vRIYsm5Lox'
1212989468543791104,2020-01-03 06:50:00,"b'Between Patriotism, Partition and Pakistan, here\xe2\x80\x99s how #FaizAhmedFaiz became a poet https://t.co/XuhEX9nqb5 https://t.co/zC1qHNtMqO'"
1212984435299123205,2020-01-03 06:30:00,b'Watch: A magpie makes fire engine sounds amidst devastating bushfires in Australia https://t.co/QG2HtYIBce'
1212983965230878720,2020-01-03 06:28:08,b'Iran\xe2\x80\x99s supreme leader vows revenge against \xe2\x80\x98criminals\xe2\x80\x99 who killed top general in Baghdad https://t.co/GGdzgsCnVP https://t.co/8WwAXASJVL'
1212982716011929601,2020-01-03 06:23:10,"b'RT @aditya_c19: ""How are age fraud and fixing different in any way? In both cases, is it not blatant cheating?"" Rahul Dravid had said once.\xe2\x80\xa6'"
1212979402604269568,2020-01-03 06:10:00,b'Movie review: #SabKushalMangal https://t.co/s0erFAzj3J https://t.co/TbFHSvFEXQ'
1212976746145832961,2020-01-03 05:59:26,"b""RT @thefield_in: #BushfireCrisis\n\nMany top Australian tennis and cricket players followed Nick Kyrgios and Chris Lynn's lead in pledging to\xe2\x80\xa6"""
1212974369040814080,2020-01-03 05:50:00,b'Watch: This elderly man is winning hearts after he rescued a stranded kitten using a chair\n\nhttps://t.co/6jx0jI4ZXf'
1212970629005074434,2020-01-03 05:35:08,"b'Centre rejects Maharashtra\xe2\x80\x99s tableau in Republic Day parade, Opposition says decision is prejudiced\xe2\x80\xa6 https://t.co/wqHOQAx8fQ'"
1212969335888609281,2020-01-03 05:30:00,b'Watch: Spirited New Year wishes from a Delhi government school\xe2\x80\x99s students in 18 Indian languages\n\nhttps://t.co/7EDzZ6Y8f4'
1212968081565179904,2020-01-03 05:25:01,"b'Top news: Narendra Modi labels everyone Pakistani when he is cornered, says Congress\xe2\x80\x99 Manish Tewari\xe2\x80\xa6 https://t.co/1YjL1PIrmo'"
1212966957097467906,2020-01-03 05:20:33,b'RT @TheReel_in: Movie review: \xe2\x80\x98Cats\xe2\x80\x99 https://t.co/5LKGWa7ZU7\n\nA purr-fect disaster https://t.co/3hB8ANUXoq'
1212964302681853952,2020-01-03 05:10:00,b'Movie review: #ShimlaMirchi https://t.co/nJQyTOLtlv (via @TheReel_in)\n\n Hints of spice but mostly flat https://t.co/DW1KSZNgnn'
1212962825670287362,2020-01-03 05:04:08,b'Congress attacks Modi for \xe2\x80\x98fake nationalism\xe2\x80\x99 and criticising Pakistan but never China https://t.co/M1dkVkjYvD https://t.co/fXvrHf012I'
1212959269932457984,2020-01-03 04:50:00,"b'If Manjot Kalra is guilty of age fraud, should India still be the Under-19 world champions? https://t.co/YBN4iy43WL\xe2\x80\xa6 https://t.co/3CDwnPJlbF'"
1212958679823048705,2020-01-03 04:47:39,b'Bihar: Two Hindu fringe outfit members charged for murder of teenager during #CitizenshipAct protest\xe2\x80\xa6 https://t.co/dbNdzaZALS'
1212958445046915072,2020-01-03 04:46:43,b'RT @TheReel_in: Movie Review: #SabKushalMangal https://t.co/dmPQt9NDe2 https://t.co/j4Ft1Cmpsf'
