id,created_at,text
1209300159080779776,2019-12-24 02:30:00,b'\xe2\x80\x98Why kill our children?\xe2\x80\x99: Blood and tears in an Uttar Pradesh town after Citizenship Act protests\xe2\x80\xa6 https://t.co/oSW3t7ivtp'
1209295125614153728,2019-12-24 02:10:00,"b'""We will not leave from here till the Act is withdrawn."" \n\nVoices from Delhi\xe2\x80\x99s Shaheen Bagh, where residents have b\xe2\x80\xa6 https://t.co/0UMZus7iuO'"
1209290092394627072,2019-12-24 01:50:00,"b'Last year, the Swiss National Bank\xe2\x80\x99s annual report said money kept by Indians in Swiss banks rose over 50% to 1.01\xe2\x80\xa6 https://t.co/jViSIzrq29'"
1209285059288748033,2019-12-24 01:30:00,b'\xe2\x80\x98How dare he ask us if we consider ourselves Indians\xe2\x80\x99: These women are furious at a TV news reporter https://t.co/sPcy6b4ymz'
1209280026224414720,2019-12-24 01:10:00,b'Watch: How to turn a makeup tutorial into a primer on Citizenship Act protests https://t.co/fQRL2JctAs #CAA_NRC_Protest'
1209274992963117057,2019-12-24 00:50:00,b'I\xe2\x80\x99m an Indian Muslim and refuse to be certified as a citizen by this RSS-backed government https://t.co/lDZouLQnOX'
1209269959664099328,2019-12-24 00:30:00,"b'Schoolboys in 1990s Pakistan were taught to valourise war, conquest and violence. At what cost? https://t.co/vxu1OLvbVK'"
1209262413108764673,2019-12-24 00:00:00,"b'Lail-i-Nisa has been in the city since 1958, and says \xe2\x80\x98we have never seen anything like this.\xe2\x80\x99 https://t.co/nQAGe6f3Ip'"
1209254860849369090,2019-12-23 23:30:00,b'Who wrote the Preamble to the Indian Constitution? That is one of the secrets this book probes https://t.co/WSbs3j4IRn'
1209247313081667585,2019-12-23 23:00:00,b'The agitation against a discriminatory citizenship law retrieves long-forgotten ideals. https://t.co/Sucy3uaLDC'
1209239761522548737,2019-12-23 22:30:00,"b'""The only winged eyeliner tutorial you need!""  https://t.co/fQRL2JctAs'"
1209232212404535296,2019-12-23 22:00:00,"b'Only illiterate \xe2\x80\x98puncture-wallahs\xe2\x80\x99 oppose the CAA, according to BJP MP Tejasvi Surya in Bengaluru https://t.co/3HPPKMnbBO'"
1209224661260754945,2019-12-23 21:30:00,b'Four reasons why even gender equality does not prevent sexual harassment\nhttps://t.co/eMWSZjlY5q'
1209217113061150720,2019-12-23 21:00:00,"b'After incident at Spurs, UK government urges football authorities to intensify anti-racism efforts\xe2\x80\xa6 https://t.co/zspEEG5iav'"
1209209563519434752,2019-12-23 20:30:00,b'Words from nativity: Uncovering the language of the first Christmas\nhttps://t.co/4DiZzlqp0J'
1209202012061081602,2019-12-23 20:00:00,"b'Along with Harbhajan Singh, Gutta is one of the few national level sportspersons to speak out. https://t.co/CaJiAnH7jR'"
1209194463421009920,2019-12-23 19:30:00,b'Emotional worlds: Letters Indian soldiers sent home during World War II https://t.co/jRKC3aHPRM'
1209186912931442695,2019-12-23 19:00:00,b'Why do democracies keep voting for lying politicians? Are people insensitive to falsehoods? Do we no longer care ab\xe2\x80\xa6 https://t.co/cY236JIPSV'
1209179363440095237,2019-12-23 18:30:00,b'A bunch of web series were out this year. Some of them featured stellar performances. https://t.co/d3m98GuY2e (via @TheReel_in)'
1209176951740497920,2019-12-23 18:20:25,b'The EC has not yet declared the results for the Jamshedpur East constituency. Incumbent CM Raghubar Das is trailing\xe2\x80\xa6 https://t.co/MWwZs6pT55'
1209176949777555456,2019-12-23 18:20:24,"b'The JMM emerged the single largest party with 30 seats, while its alliance partner Congress won 16 seats and RJD on\xe2\x80\xa6 https://t.co/0OgcO3L21a'"
1209176947730706432,2019-12-23 18:20:24,b'Official trends show that the BJP has won 25 seats. The Jharkhand Mukti Morcha-Congress-Rashtriya Janata Dal allian\xe2\x80\xa6 https://t.co/lakZO3xaG9'
1209174330124439552,2019-12-23 18:10:00,"b'\xe2\x80\x98A first-class seat is my right,\xe2\x80\x99 insisted the terror-accused BJP politician. https://t.co/GkN2nEe8YN'"
1209169296695398400,2019-12-23 17:50:00,"b'Starting with Gujarat in 2017, the BJP has not managed one comfortable state poll win in two years despite its mass\xe2\x80\xa6 https://t.co/fMuwpPW83W'"
1209168481955893249,2019-12-23 17:46:46,"b'#JharkhandElections: JMM-Congress-RJD alliance emerges victorious, BJP concedes defeat\nhttps://t.co/wpefm7Ztrn\xe2\x80\xa6 https://t.co/b2zIIjliL3'"
1209164901790314497,2019-12-23 17:32:32,"b'All government hospitals, primary and community health centres in Ghaziabad have been put on alert in the district,\xe2\x80\xa6 https://t.co/ikdGjjqoja'"
1209164899223425024,2019-12-23 17:32:31,b'The health department in Ghaziabad has cancelled leaves of all government doctors and paramedical staff for the nex\xe2\x80\xa6 https://t.co/BOuRVJrl7I'
1209164263597772800,2019-12-23 17:30:00,b'Lahore attack: Zia-ul-Haq\xe2\x80\x99s vision of education continues to haunt Pakistani civil society\nhttps://t.co/vxu1OLMNkk'
1209163338401239042,2019-12-23 17:26:19,"b'Official trends at this time show the JMM-Congress-RJD alliance victorious in 45 seats and ahead in two, while BJP\xe2\x80\xa6 https://t.co/XdC8SNQJx1'"
1209163336325029888,2019-12-23 17:26:19,b'BJP leader and former Jharkhand Chief Minister Arjun Munda has claimed that the misinformation spread by the Opposi\xe2\x80\xa6 https://t.co/d2dOl1JPuR'
1209159230416179206,2019-12-23 17:10:00,"b""Watch: https://t.co/cbbiMG4MOD's @ShoaibDaniyal  explains how Amit Shah\xe2\x80\x99s NRC has already begun \xe2\x80\x93 with the NPR https://t.co/IcpoiGiOOM"""
1209156390645714945,2019-12-23 16:58:43,"b'Jamal Khashoggi murder: Five sentenced to death, three top Saudi officials released https://t.co/AFWuvAusoD'"
1209154293183336451,2019-12-23 16:50:23,"b'Also watch,\n\nOnly illiterate \xe2\x80\x98puncture-wallahs\xe2\x80\x99 oppose the CAA, according to BJP MP Tejasvi Surya in Bengaluru\xe2\x80\xa6 https://t.co/bq6M1sQJJ5'"
1209154196970197002,2019-12-23 16:50:00,b'#ThePoliticalFix: The BJP\xe2\x80\x99s sneaky electoral tactic that led to massive week-long protests in India\xe2\x80\xa6 https://t.co/ZFToOcd9Aq'
1209152156894285826,2019-12-23 16:41:53,"b'RT @thefield_in: ""Racism of any kind has no place in football or anywhere else and we must confront this vile behaviour\xe2\x80\x9d\n\nREAD: \nhttps://t.\xe2\x80\xa6'"
1209151680580739072,2019-12-23 16:40:00,b'Your support is crucial: India needs independent media and independent media needs you. \nhttps://t.co/XckpbngUD8 https://t.co/Oko7IwkOVO'
1209149165105631240,2019-12-23 16:30:00,b'How to make merry amidst so much misery: Timeless advice from the 1830s\nhttps://t.co/KSCDaN4XWh https://t.co/b8XEJpCyky'
1209147399668502528,2019-12-23 16:22:59,"b'\xe2\x80\x98It was all lies\xe2\x80\x99: Modi\xe2\x80\x99s claims at rally leave CAA protestors unconvinced, agitation will continue\xe2\x80\xa6 https://t.co/MLeSdp5L6C'"
1209145770336669696,2019-12-23 16:16:31,b'RT @thefield_in: #IndianFootball \n\nWhat did we learn from the previous round of #ISL games? \n\nTakeaways: https://t.co/DC49y6h2R7'
1209144130678464512,2019-12-23 16:10:00,b'Jasprit Bumrah returns to India\xe2\x80\x99s T20I and ODI squads; Rohit Sharma rested for Sri Lanka series\nhttps://t.co/n6DyhzhGLa (via @thefield_in)'
1209144031222984704,2019-12-23 16:09:36,"b'RT @thefield_in: #Racism #PremierLeague \n\nGuardiola: \xe2\x80\x9cIt is a battle we have to fight it every day, in schools especially, in the families\xe2\x80\xa6'"
1209140065475035136,2019-12-23 15:53:51,"b'Watch: Police raided Muslim home in western UP, threatened to set it on fire, alleges young woman\xe2\x80\xa6 https://t.co/ueg8kBlrh4'"
1209138215845650432,2019-12-23 15:46:30,"b'\xe2\x80\x9cShe [Zafar] was beaten brutally by the police. She was hit on her back and her hair was pulled,\xe2\x80\x9d Congress state pr\xe2\x80\xa6 https://t.co/ywxd6DW3xf'"
1209138213681426434,2019-12-23 15:46:29,"b'A Lucknow court rejects the bail petition of Congress leader Sadaf Zafar, who was arrested while protesting against\xe2\x80\xa6 https://t.co/9YKCeYC2rl'"
1209136533199998976,2019-12-23 15:39:48,"b'Raghubar Das says people\xe2\x80\x99s mandate was not in favour of BJP. \n\n\xe2\x80\x9cBut whatever has been the verdict of the ppl, we re\xe2\x80\xa6 https://t.co/E8rsBOupZt'"
1209136012221276161,2019-12-23 15:37:44,b'The Ghaziabad Police register a case against Aam Aadmi Party MLA Amanatullah Khan for allegedly sharing an objectio\xe2\x80\xa6 https://t.co/bWYSHAcRYL'
1209135697518481414,2019-12-23 15:36:29,"b'Harsh Vardhan Shringla, India\xe2\x80\x99s US envoy, appointed next foreign secretary https://t.co/EaJYhITq9A'"
1209134709076307968,2019-12-23 15:32:33,b'RT @thefield_in: #EuropeanFootball \n\nChristmas will very different for the fans of Inter &amp; AC Milan and other talking points from European\xe2\x80\xa6'
1209132935216914434,2019-12-23 15:25:31,b'A look at the headlines right now. https://t.co/tRDc296IAs'
1209132826131435520,2019-12-23 15:25:05,b'Telangana encounter: AIIMS team conducts second autopsy on bodies of four accused killed by police https://t.co/seCHp0PV9s'
1209132431527170052,2019-12-23 15:23:30,"b'The Jharkhand Mukti Morcha, Congress and Rashtriya Janata Dal alliance is ahead in 47 seats in the 81-member Assemb\xe2\x80\xa6 https://t.co/yvKwdMZf8t'"
1209132429543239681,2019-12-23 15:23:30,b'Jharkhand Chief Minister Raghubar Das tenders his resignation. https://t.co/FAkEBnz2cF'
1209131347526029316,2019-12-23 15:19:12,b'RT @thefield_in: #NZvIND \n\nSome big names in India A squads for the tour of New Zealand!\n\nDetails here: \n\nhttps://t.co/auFKpkTbjY'
1209130402889158656,2019-12-23 15:15:27,"b'\xe2\x80\x9cThe country will not let you attack the Constitution and suppress voice of \xe2\x80\x98Bharat Mata\xe2\x80\x99,\xe2\x80\x9d Gandhi adds.\xe2\x80\xa6 https://t.co/EyRBpKFvyx'"
1209130400452243457,2019-12-23 15:15:26,"b'Referring to Modi\xe2\x80\x99s comment that protestors could easily be identified by their clothes, Gandhi says: \xe2\x80\x9cWhen it come\xe2\x80\xa6 https://t.co/YnjrufXraq'"
1209130398116040704,2019-12-23 15:15:26,"b'\xe2\x80\x9cNarendra Modi, when you get students shot at by bullets and when you get them lathicharged, or when you threaten j\xe2\x80\xa6 https://t.co/lFb7TKOqcQ'"
1209130396153069568,2019-12-23 15:15:25,"b'\xe2\x80\x9cYou could not provide jobs and destroyed economy, that is why you are hiding behind hate. You have been taught how\xe2\x80\xa6 https://t.co/a93KhNE5NE'"
1209130394102091776,2019-12-23 15:15:25,"b'\xe2\x80\x9cNarendra Modi should tell country why he is suppressing the voice of students and why they are not getting jobs,\xe2\x80\x9d\xe2\x80\xa6 https://t.co/xpmz829TxQ'"
1209130391845691395,2019-12-23 15:15:24,b'Congress leader Rahul Gandhi criticises the Bharatiya Janata Party and Prime Minister Narendra Modi at the party\xe2\x80\x99s\xe2\x80\xa6 https://t.co/9TrYwYMYoY'
1209129163149283330,2019-12-23 15:10:31,b'RT @thefield_in: OFFICIAL: \n\n#JaspritBumrah is back for T20Is against Sri Lanka as well as the ODIs against Australia.\n\nREAD: https://t.co/\xe2\x80\xa6'
1209129031427403781,2019-12-23 15:10:00,"b'Harmanpreet Kaur, Smriti Mandhana, Veda Krishnamurthy named captains for T20 Challenger Trophy\nhttps://t.co/AVhCe1qhzN (via @thefield_in)'"
1209123998287593473,2019-12-23 14:50:00,b'Assam\xe2\x80\x99s NRC consensus: Lack of public disorder after draft list didn\xe2\x80\x99t mean absence of violence\xe2\x80\xa6 https://t.co/rRbiW5yrFM'
1209123495642193920,2019-12-23 14:48:00,b'RT @thefield_in: Game time in Ranji Trophy for Ishant Sharma and Shikhar Dhawan.\n\nREAD: https://t.co/AmoTgpGqqB'
1209121481575354375,2019-12-23 14:40:00,b'Your support is crucial: India needs independent media and independent media needs you. \nhttps://t.co/Xckpbnyw1I https://t.co/h1nzYFtKpE'
1209120817360990208,2019-12-23 14:37:21,"b'Jagan Mohan Reddy joins anti-NRC bandwagon, says Andhra Pradesh will not implement citizenship test https://t.co/jW7RRCULLo #CAA_NRC_Protest'"
1209118965412306946,2019-12-23 14:30:00,b'\xe2\x80\x98Come out and condemn violence\xe2\x80\x99: Watch badminton player @Guttajwala\xe2\x80\x99s appeal to Indian sportspeople\nhttps://t.co/CaJiAnH7jR'
1209114115853049856,2019-12-23 14:10:44,b'PM Modi is like a god for people who will benefit from new citizenship law: Shivraj Singh Chouhan\nhttps://t.co/0WRXqtR5df'
1209113931777658880,2019-12-23 14:10:00,b'Watch: The moment when two luxury cruise ships collided at a port in #Mexico\nhttps://t.co/p06h7ZcVER'
1209112907906088960,2019-12-23 14:05:56,"b'The alliance of the Jharkhand Mukti Morcha, Congress and Rashtriya Janata Dal is currently ahead in 46 seats in the\xe2\x80\xa6 https://t.co/49GPYQxqsn'"
1209112551650279428,2019-12-23 14:04:31,"b'RT @thefield_in: #INDvSL #INDvAUS \n\nWelcome back, @Jaspritbumrah93!\n\nSquad details here with MSK Prasad providing the latet updates: \n\nhttp\xe2\x80\xa6'"
1209112214637924353,2019-12-23 14:03:10,b'Shamsuddin\xe2\x80\x99s wife and children have fled the neighbourhood. The family does not know where the police have taken hi\xe2\x80\xa6 https://t.co/WtM9EMQCJE'
1209112152180588545,2019-12-23 14:02:55,b'Video footage accessed by https://t.co/cbbiMGmnGb shows an elderly man being dragged towards a Uttar Pradesh police\xe2\x80\xa6 https://t.co/eNfFFqkdcj'
1209109819296079872,2019-12-23 13:53:39,"b'\xe2\x80\x98New chapter in Jharkhand\xe2\x80\x99s history,\xe2\x80\x99 says a jubilant JMM leader Hemant Soren after poll triumph\xe2\x80\xa6 https://t.co/TK9QNHPUH2'"
1209108898743037953,2019-12-23 13:50:00,b'\xe2\x80\x98Hum sab ek hai\xe2\x80\x99: Can popular protests bring political change?\nhttps://t.co/Sucy3usn2c | @p_semolina \n\nThe agitatio\xe2\x80\xa6 https://t.co/PVDn0XDRPU'
1209107677646864387,2019-12-23 13:45:09,b'The BJP\xe2\x80\x99s chief ministerial face and incumbent CM Raghubar Das contested from the Jamshedpur (East) constituency. H\xe2\x80\xa6 https://t.co/8I8d3sy4KD'
1209106903415975936,2019-12-23 13:42:04,b'RT @thefield_in: 2009: Ravindra Jadeja disappointed after Sachin Tendulkar was dismissed against Australia in Hyderabad. \n\n2019: Ravindra J\xe2\x80\xa6'
1209106225406730241,2019-12-23 13:39:22,b'Here are the latest trends according to the Election Commission of India. https://t.co/FAkEBnz2cF #JharkhandResults\xe2\x80\xa6 https://t.co/mOpmSrH6VD'
1209105258065973248,2019-12-23 13:35:32,b'RT @thefield_in: #PAKvSL \n\nPakistan\xe2\x80\x99s players went to the Sri Lanka dressing room to thank them for helping Test cricket return to the coun\xe2\x80\xa6'
1209105062288490496,2019-12-23 13:34:45,b'The assailants reportedly shouted \xe2\x80\x98Jai Shri Ram\xe2\x80\x99 as they beat up the campaigners in the city\xe2\x80\x99s Baghajatin locality\xe2\x80\xa6 https://t.co/DOhEpnBVJM'
1209105060312956928,2019-12-23 13:34:45,b'Kolkata: Feminist group assaulted for campaigning against citizenship law and NRC https://t.co/SMMdJq6SZi'
1209105058060615680,2019-12-23 13:34:44,b'Andhra Pradesh Chief Minister YS Jaganmohan Reddy says his government is against the nationwide National Register o\xe2\x80\xa6 https://t.co/NQPEqVkcp4'
1209104425555394563,2019-12-23 13:32:13,"b'Prime Minister Narendra Modi congratulates the alliance of the Jharkhand Mukti Morcha, Congress and Rashtriya Janat\xe2\x80\xa6 https://t.co/tRlaNbkucK'"
1209103865410244608,2019-12-23 13:30:00,b'Why do people vote for politicians they know are liars? https://t.co/Ooa3auWvLL'
1209103121332334593,2019-12-23 13:27:02,"b'RT @thefield_in: #IndianFootball \n\nAs the first half of the season comes to an end, a look at the key takeaways from Indian Super League ac\xe2\x80\xa6'"
1209099074504294400,2019-12-23 13:10:57,"b'RT @thefield_in: #IPL2020 #IPLAuction2020\n\n#Thread \n\nWith the #IPLAuction2020 done and dusted, the squads for next season of Indian Premier\xe2\x80\xa6'"
1209098832505499648,2019-12-23 13:10:00,"b'\xe2\x80\x98A first-class seat is my right,\xe2\x80\x99 insisted the terror-accused politician. https://t.co/GkN2nEvJQl'"
1209097825339854848,2019-12-23 13:06:00,"b'#JharkhandElectionResults | Starting with Gujarat in 2017, the BJP has not managed one comfortable state poll win i\xe2\x80\xa6 https://t.co/1JzfrRSwpa'"
1209096778730991616,2019-12-23 13:01:50,b'RT @TheReel_in: #PangaTrailer: Kangana Ranaut tackles her kabaddi dreams\nhttps://t.co/voAZcfYGbU'
1209096743284903936,2019-12-23 13:01:42,b'RT @thefield_in: #INDvWI \n\nNicholas Pooran is grateful for the role played by Kieron Pollard in his comeback from a traumatic accident a fe\xe2\x80\xa6'
1209096415399432193,2019-12-23 13:00:24,"b'Jharkhand confirms the trend for BJP: Huge Lok Sabha victory, poor state results https://t.co/uG4C9mnQql | @RohanV\xe2\x80\xa6 https://t.co/8CHVmYjzOR'"
1209096183173373957,2019-12-23 12:59:28,b'BJP concedes defeat. \xe2\x80\x9cWe respect the mandate given by the people of Jharkhand. We express our gratitude towards the\xe2\x80\xa6 https://t.co/j9gwZqBv03'
1209094219182178304,2019-12-23 12:51:40,"b'Last year, the Swiss National Bank\xe2\x80\x99s annual report said money kept by Indians in Swiss banks rose over 50% to 1.01\xe2\x80\xa6 https://t.co/aCrcILrub2'"
1209094216862715905,2019-12-23 12:51:39,b'Centre refuses to reveal details of Indians\xe2\x80\x99 Swiss bank accounts in response to RTI query https://t.co/FScTDGrNfO'
1209093799231791105,2019-12-23 12:50:00,b'A UN aid worker took the horrors of Sri Lanka\xe2\x80\x99s civil war and turned conflict into a graphic novel https://t.co/ndxb6LCgbZ'
1209092421742555136,2019-12-23 12:44:31,"b'#Jharkhand Chief Minister Raghubar Das concedes defeat. \xe2\x80\x9cIt is not BJP\xe2\x80\x99s defeat, it is my defeat,\xe2\x80\x9d Das says. \n\nAcco\xe2\x80\xa6 https://t.co/QIA4fNsmnm'"
1209092239458127872,2019-12-23 12:43:48,b'Here are the latest trends according to the Election Commission https://t.co/FAkEBnz2cF #JharkhandAssemblyElections\xe2\x80\xa6 https://t.co/aJ36cUn40x'
1209092229165223938,2019-12-23 12:43:45,b'Delhi Chief Minister Arvind Kejriwal says the Jharkhand Assembly poll results were a verdict against the NRC and th\xe2\x80\xa6 https://t.co/j47zPaskcu'
1209092022914564096,2019-12-23 12:42:56,b'RT @thefield_in: Embattled Rishabh Pant has garnered criticism not only for his struggles with the bat but also his glovework.   \n\nRead: ht\xe2\x80\xa6'
1209091282506854405,2019-12-23 12:40:00,b'Your support is crucial: India needs independent media and independent media needs you. \nhttps://t.co/Xckpbnyw1I https://t.co/ouBG1T0eyV'
1209088765920251907,2019-12-23 12:30:00,b'Environmentalists in India are trying to map peatlands. How will this help combat climate change? https://t.co/9Zp0LgU2Lb'
1209086455819034624,2019-12-23 12:20:49,b'RT @thefield_in: #WomensT20ChallengerTrophy\n\nThree strong squads have been picked by @BCCIWomen.\n\nDetails: https://t.co/J2TSmHbi5m'
1209085532958908416,2019-12-23 12:17:09,"b'In photos: Thousands take to the streets against the Citizenship Act in Bengaluru, Chennai https://t.co/QN0Gu9k5LT\n\n#CAA_NRC_Protest'"
1209083732746850304,2019-12-23 12:10:00,"b'Only illiterate \xe2\x80\x98puncture-wallahs\xe2\x80\x99 oppose the CAA, according to BJP MP Tejasvi Surya in #Bengaluru\nhttps://t.co/3HPPKMnbBO #CAA_NRC_Protest'"
1209081538614153218,2019-12-23 12:01:17,b'Nadda alleges that West Bengal Chief Minister Mamata Banerjee did not condemn the violence during protests against\xe2\x80\xa6 https://t.co/eryJztb1nH'
1209081536231817216,2019-12-23 12:01:16,"b'Muslims flourished in our country but Hindus were tortured in Pakistan, says Nadda at the Kolkata rally, PTI report\xe2\x80\xa6 https://t.co/yNqCA469H5'"
1209079328060801024,2019-12-23 11:52:30,"b'RT @thefield_in: #IPL2020 #IPLAuction2020 \n\nAnd finally...\n\nA solid first XI, and exciting young talent brought in. Can Rajasthan Royals fi\xe2\x80\xa6'"
1209078699632533506,2019-12-23 11:50:00,b'Doesn\xe2\x80\x99t matter how you start: Twitter hails Dhoni as he completes 15 years in international cricket\xe2\x80\xa6 https://t.co/YG1cVjH0cS'
1209078622926979072,2019-12-23 11:49:41,b'Nationalist Congress Party chief Sharad Pawar says the result shows that people are not with the Bharatiya Janata P\xe2\x80\xa6 https://t.co/hX50GrLnK2'
1209075607457292288,2019-12-23 11:37:43,"b'Soren also thanks his alliance partners \xe2\x80\x93 Congress leaders Sonia Gandhi, Rahul Gandhi, Priyanka Gandhi and RJD\xe2\x80\x99s La\xe2\x80\xa6 https://t.co/KqcxrukfdK'"
1209075604781273088,2019-12-23 11:37:42,"b'The opposition\xe2\x80\x99s CM candidate, Hemant Soren, thanks people for the mandate. His party, the Jharkhand Mukti Morcha,\xe2\x80\xa6 https://t.co/zEYalgrgvr'"
1209075252476538880,2019-12-23 11:36:18,b'RT @thefield_in: #IPL2020 #IPLAuction2020 \n\nImprovements made on an already solid-looking squad. Will 2020 be the year for Delhi Capitals?\xe2\x80\xa6'
1209074473359433729,2019-12-23 11:33:12,"b'BJP\xe2\x80\x99s chief ministerial face and incumbent, Raghubar Das, concedes defeat, according to NDTV. \xe2\x80\x9cThe BJP will accept\xe2\x80\xa6 https://t.co/7nDyAdNmQD'"
1209074246338482178,2019-12-23 11:32:18,"b'The Trinamool Congress and other opposition parties are misguiding people on the Citizenship Act, Nadda claims, acc\xe2\x80\xa6 https://t.co/ZARwlBmr2n'"
1209074243918417920,2019-12-23 11:32:17,"b'BJP working president JP Nadda, at a rally in Kolkata, claims Bengal stands with Prime Minister Narendra Modi and w\xe2\x80\xa6 https://t.co/rFtosktpPi'"
1209074239925407746,2019-12-23 11:32:16,b'Congress leader P Chidambaram says all non-BJP parties must rally around his party to save the Indian Constitution.\xe2\x80\xa6 https://t.co/39EdIkzgeN'
1209073666639749121,2019-12-23 11:30:00,b'Watch: How to turn a makeup tutorial into a primer on Citizenship Act protests https://t.co/fQRL2Ju4Z2 #CAA_NRC_Protest'
1209072618063577088,2019-12-23 11:25:50,"b'Also watch, \n\nMassive anti-Citizenship Act protests continue, this time in #Bengaluru and #Chennai\xe2\x80\xa6 https://t.co/afn7R1w9fC'"
1209071688677130240,2019-12-23 11:22:08,b'RT @thefield_in: #IPL2020 #IPLAuction2020 \n\nA decent auction as SunRisers Hyderabad seemed content with what they already had instead of sh\xe2\x80\xa6'
1209071415875342336,2019-12-23 11:21:03,"b'\xe2\x80\x98Stop all anti-Citizenship Act campaigns,\xe2\x80\x99 Calcutta High Court directs Trinamool government https://t.co/eqoIWd8rU6'"
1209070896943517696,2019-12-23 11:18:59,"b'Congress leaders read the Constitution\xe2\x80\x99s Preamble in Raj Ghat in Delhi, where a protest against the Citizenship (Am\xe2\x80\xa6 https://t.co/2leHoogM13'"
1209070490700017664,2019-12-23 11:17:23,"b""RT @tajmahalfoxtrot: Dear @scroll_in readers, thank you for the burst of subscriptions we've had over the past week. In this time when inde\xe2\x80\xa6"""
1209070145114529792,2019-12-23 11:16:00,b'RT @thefield_in: #IPL2020 #IPLAuction2020 \n\nPlenty of money spent in bringing in Pat Cummins but do Kolkata Knight Riders have the squad st\xe2\x80\xa6'
1209069999018524672,2019-12-23 11:15:25,b'Massive turnout in #Bengaluru for protest against Citizenship Act. Shops in and around Shivajinagar and Frazer Town\xe2\x80\xa6 https://t.co/XwU5JMdlTN'
1209068990791708673,2019-12-23 11:11:25,"b'Hemant Soren, the chief ministerial candidate of the Opposition alliance, is leading in Barhait by 14,166 votes, an\xe2\x80\xa6 https://t.co/rJbIlAdjvH'"
1209068987578867714,2019-12-23 11:11:24,b'Latest trends according to the Election Commission of India:\n\nFollow live updates here: https://t.co/FAkEBnz2cF\xe2\x80\xa6 https://t.co/P3oiv2i9zv'
1209068633231523840,2019-12-23 11:10:00,b'#ThePoliticalFix | Everything you need to know about the massive protests that have erupted in India \xe2\x80\x94 and what the\xe2\x80\xa6 https://t.co/J2mUONVdR6'
1209066992272982016,2019-12-23 11:03:28,b'RT @thefield_in: #IPL2020 #IPLAuction2020 \n\nIt must be said Kings XI Punjab had a good auction but is that enough to clinch the elusive tro\xe2\x80\xa6'
1209066044100268032,2019-12-23 10:59:42,b'Congress leaders reach Raj Ghat for the protests against the new citizenship law. https://t.co/21hHo0PLLA\n\n#CAA_NRC_support'
1209065459670085632,2019-12-23 10:57:23,b'RT @thefield_in: #15YearsofDhoni\n\nCaptain. Leader. Legend. \n\nWhat a career MS Dhoni has had! \xf0\x9f\x91\x8f\n\nhttps://t.co/rgKwy5zNFe'
1209064850204135424,2019-12-23 10:54:58,"b'RT @thefield_in: #IPL2020 #IPLAuction2020 \n\nDespite what the coaching staff think, Royal Challengers Bangalore had an ordinary auction. Can\xe2\x80\xa6'"
1209063600020738050,2019-12-23 10:50:00,"b'\xe2\x80\x98Protestors have been brainwashed\xe2\x80\x99: At Modi\xe2\x80\x99s Delhi rally, supporters cheer police action https://t.co/6XBBueh6U0\xe2\x80\xa6 https://t.co/giK9lc36LU'"
1209061083471704064,2019-12-23 10:40:00,b'Your support is crucial: India needs independent media and independent media needs you. \nhttps://t.co/XckpbngUD8 https://t.co/QTD4auWQTQ'
1209059971196801025,2019-12-23 10:35:35,"b'RT @thefield_in: #IPL2020 #IPLAuction \n\nChennai Super Kings continue to place their trust in experience but is MS Dhoni and Co taking it, p\xe2\x80\xa6'"
1209058818543386625,2019-12-23 10:31:00,"b""What were the Mughals' favourite books?\n\nhttps://t.co/HheZJMWXIR https://t.co/nDTlHuqUxY"""
1209058768572387330,2019-12-23 10:30:48,"b'BJP working president JP Nadda, at the Kolkata rally, accuses Mamata Banerjee of \xe2\x80\x9cvote-bank politics\xe2\x80\x9d.\xe2\x80\xa6 https://t.co/uuc9r2yREh'"
1209058629413814273,2019-12-23 10:30:15,b'RT @thefield_in: #IPL2020 #IPLAuction \n\nMumbai Indians look primed to be the favourites for the title yet again. \n\nRead: https://t.co/27QMF\xe2\x80\xa6'
1209055397602111488,2019-12-23 10:17:24,"b'Saryu Roy\xe2\x80\x99s margin against Raghubar Das is now 7,484 votes.\n\nFollow live updates here: https://t.co/FAkEBnQDBf\xe2\x80\xa6 https://t.co/gzh87lNcBl'"
