id,created_at,text
1215114390258642944,2020-01-09 03:33:41,"b'Listen: \xe2\x80\x98Ve Musalman The,\xe2\x80\x99 a powerful composition by Hindi poet Devi Prasad Mishra\n\nhttps://t.co/DgRXfGKKSw'"
1215114264798646273,2020-01-09 03:33:11,b'Delhi: One killed after fire breaks out in paper factory\n\nhttps://t.co/4NHVpD2xs0 https://t.co/vkTFJAfUso'
1215113715793698816,2020-01-09 03:31:00,"b'No, Deepika Padukone\xe2\x80\x99s \xe2\x80\x98Chhapaak\xe2\x80\x99 does not portray Muslim acid attack convict as Hindu named Rajesh\xe2\x80\xa6 https://t.co/uVKuiWngHK'"
1215108897691725824,2020-01-09 03:11:51,b'A look at the headlines right now.\n\nhttps://t.co/TVLslGbxKj'
1215108789218639872,2020-01-09 03:11:25,"b'The first information report, which https://t.co/cbbiMGmnGb accessed, shows that the protestors have been charged u\xe2\x80\xa6 https://t.co/ht4v1xf8mS'"
1215108682867855361,2020-01-09 03:11:00,b'Voices from the labour strike: Why workers across India observed a \xe2\x80\x98Bharat bandh\xe2\x80\x99 on Wednesday\xe2\x80\xa6 https://t.co/KyARk8YIU2'
1215103397721862144,2020-01-09 02:50:00,"b'Trump\xe2\x80\x99s trade war with China benefits lobbyists, but is bleeding small US businesses dry\nhttps://t.co/Lv7Jw2YONe'"
1215100586191769602,2020-01-09 02:38:49,"b'JNU attacks: In colleges, universities, and outside, protests rage across the country\n\nhttps://t.co/N9WCEejPJl'"
1215098364515291137,2020-01-09 02:30:00,"b'From supporting the NRC in Assam to opposing the exercise across India, @chetan_bhagat has come a long way.  https://t.co/oySu5vEBrO'"
1215093331425812480,2020-01-09 02:10:00,"b'In a bid to #BoycottChhapaak, many trolls tweet cancelled movie tickets \xe2\x80\x93 for exactly the same seats\xe2\x80\xa6 https://t.co/fwvKnL8i5f'"
1215088298445692929,2020-01-09 01:50:00,b'Indians just can\xe2\x80\x99t stand people whose political opinions are different from theirs \xe2\x80\x93 be it on Twitter or inside a b\xe2\x80\xa6 https://t.co/mU40CBRih0'
1215083265691922432,2020-01-09 01:30:00,b'\xe2\x80\x98We are not scared\xe2\x80\x99: Why @deepikapadukone\xe2\x80\x99s JNU visit matters https://t.co/qNFxF8rEdp'
1215078232053166080,2020-01-09 01:10:00,"b'From Amit Shah\xe2\x80\x99s \xe2\x80\x98Netflix\xe2\x80\x99 missed call campaign to Bollywood meetings, BJP is hoping to change the narrative on the\xe2\x80\xa6 https://t.co/Ja6q1bRDp5'"
1215073198846308353,2020-01-09 00:50:00,b'You are founded on the biggest physical and cultural genocide ever witnessed in history. How could I have believed\xe2\x80\xa6 https://t.co/q0KwEJCegx'
1215068166159831041,2020-01-09 00:30:00,"b""A product of the party's quiet Bollywood outreach dinner? https://t.co/WaVMLEyUCr"""
1215060617490382848,2020-01-09 00:00:00,"b'Watch: Gujarat\xe2\x80\x99s Jignesh Mevani condemns JNU attack, says it has come after strategic propaganda https://t.co/mCdbV3icsm'"
1215053066577203201,2020-01-08 23:30:00,b'#JNUAttack: Watch demonstrations in Lahore in solidarity with Indian students https://t.co/aQmMlzHd6B'
1215045517903835136,2020-01-08 23:00:00,b'The attack was mounted in retaliation to the assassination of top Iranian military commander General Qassem Soleima\xe2\x80\xa6 https://t.co/tHVPifTBoh'
1215037967602864129,2020-01-08 22:30:00,b'A global development organisation has helped devise a method to increase the shelf life of the produce. https://t.co/APQNnYYleJ'
1215030418296078337,2020-01-08 22:00:00,b'Immigrants must come together to defeat a broken immigration system and laws that pit them against each other. https://t.co/WaBWRyIsF2'
1215022867395600385,2020-01-08 21:30:00,b'Watch: Indian \xe2\x80\x98Spy Princess\xe2\x80\x99 Noor Inayat Khan and Ada Lovelace appear in latest #DoctorWho episode\nhttps://t.co/rwT1BkpmcU'
1215015317472206848,2020-01-08 21:00:00,b'This narrows approaches often often worsens existing vulnerabilities like socio-economic disparities. https://t.co/DL0Sws8PUT'
1215007768102363137,2020-01-08 20:30:00,"b'With 928 points, Kohli is way ahead of second-placed Australian maestro Steve Smith (911). https://t.co/rbm5nsmZRY (via @thefield_in)'"
1215000218921390081,2020-01-08 20:00:00,b'The Nobel laureate said the amended citizenship law was unconstitutional and the Supreme Court should turn it down. https://t.co/P0B2PF5UxK'
1214992668784095233,2020-01-08 19:30:00,b'The kind of shots he has is superb: Gautam Gambhir praises India opener KL Rahul for his good form\xe2\x80\xa6 https://t.co/AAkHUzf105'
1214987635288084481,2020-01-08 19:10:00,b'Establishment-friendly news anchor Anjana Om Kashyap says CAA and NRC can be a \xe2\x80\x98lethal combination\xe2\x80\x99 https://t.co/Qo10NMBovK'
1214982602077212672,2020-01-08 18:50:00,b'JNU attacks: Watch elderly man dancing at the Gateway of India protest in Mumbai https://t.co/3ddBGjmsf3'
1214978291938938880,2020-01-08 18:32:52,"b'This novel is a breathless ride through love and sex, power and slavery, crime and trafficking https://t.co/6XEqIIRMky'"
1214977568857894917,2020-01-08 18:30:00,b'Watch: Philosopher Daniel Dennett explains that we don\xe2\x80\x99t see as much or as deeply as we think we do https://t.co/BjGa1kGhrW'
1214973555462545411,2020-01-08 18:14:03,"b'Maharashtra district polls: BJP loses five zilla parishads, including RSS bastion Nagpur\nhttps://t.co/yVV8pKRL3k'"
1214972535579693056,2020-01-08 18:10:00,"b'\xe2\x80\x98A mob was at our door in 5 minutes\xe2\x80\x99: Surya Rajappan, evicted from her Delhi house for opposing CAA\xe2\x80\xa6 https://t.co/CV7cMvRYVI'"
1214970020142419971,2020-01-08 18:00:00,b'Some Hindutva supports have called for a boycott of Deepika Padukone\xe2\x80\x99s new movie after she attended a protest meeti\xe2\x80\xa6 https://t.co/d7ZoXT5smx'
1214967502448537601,2020-01-08 17:50:00,b'\xe2\x80\x98Take another route\xe2\x80\x99: Bengal BJP chief Dilip Ghosh refuses to allow ambulance on party rally road https://t.co/Kd5qQEGo4L'
1214962470562889729,2020-01-08 17:30:00,"b'Seven actors, singers and directors made their pro-CAA views known. https://t.co/WaVMLEQvtZ'"
1214958657181380609,2020-01-08 17:14:51,b'The foreign minister of Iraq has pledged to summon the ambassador of Iranian envoy over the \xe2\x80\x9cviolation\xe2\x80\x9d of the coun\xe2\x80\xa6 https://t.co/N5FvgqPRtM'
1214958655247810560,2020-01-08 17:14:50,b'The US president also announces immediate \xe2\x80\x9cadditional punishing sanctions\xe2\x80\x9d on Iran. https://t.co/oznVmE3ZwI'
1214958543763197952,2020-01-08 17:14:24,b'Trump alleges that the missiles fired by Iran were paid for by\xe2\x80\x9d funds paid for by the previous administration\xe2\x80\x9d \xe2\x80\x93 a\xe2\x80\xa6 https://t.co/MAsp1m1ORa'
1214958539669553152,2020-01-08 17:14:23,b'Trump reiterates his administration\xe2\x80\x99s reasons for assassinating Quds Force chief Qassem Soleimani. The Iranian mili\xe2\x80\xa6 https://t.co/ajF9k24itk'
1214958535915622400,2020-01-08 17:14:22,b'Donald Trump says Iran \xe2\x80\x9cappears to be standing down\xe2\x80\x9d and claims no American or Iraqi lives were lost in Tehran\xe2\x80\x99s mi\xe2\x80\xa6 https://t.co/5y43VaTGS8'
1214957435946860544,2020-01-08 17:10:00,"b'In Jharkhand, a homegrown innovation is driving up potato farmers\xe2\x80\x99 incomes https://t.co/APQNnYYleJ'"
1214952403079847936,2020-01-08 16:50:00,b'\xe2\x80\x98They will come at you with any number of weapons\xe2\x80\x99: @anuragkashyap72 on the government https://t.co/jxizafFPwQ'
1214947937958055936,2020-01-08 16:32:15,b'RT @thefield_in: #ISL #FCGNEU\n\nCorominas netted his 49th goal in the ISL as @FCGoaOfficial outplayed an erratic NorthEast United side.\n\nRep\xe2\x80\xa6'
1214947369621630988,2020-01-08 16:30:00,"b'For nearly four months after Marazi died, the Jammu and Kashmir police denied the death had taken place. https://t.co/Ccwsf2ai28'"
1214947139886841856,2020-01-08 16:29:05,b'#CitizenshipAct: BJP MP Swapan Dasgupta claims he was held hostage by a \xe2\x80\x98mob\xe2\x80\x99 at Visva Bharati\nhttps://t.co/eBhW8T6ANQ'
1214942338889347072,2020-01-08 16:10:00,b'Join the #ScrollFood community on:\n\nFacebook: https://t.co/5UfvBlPMN6\nInstagram: https://t.co/Rywo1GVrTH https://t.co/1nHPcQzd32'
1214942336620355585,2020-01-08 16:10:00,"b'#AustralianBushfires: In the country\xe2\x80\x99s hour of need, PM Scott Morrison failed to step up\nhttps://t.co/SRs1uYFTVj #AustralianFires'"
1214942321587867649,2020-01-08 16:09:56,b'Follow these steps to contribute to #ScrollFood.\nhttps://t.co/twO9F6pKUW'
1214942318999900160,2020-01-08 16:09:56,b'#ScrollFood | We are building the biggest encyclopedia of recipes in India. Be a part of our journey. https://t.co/riocwRKtcx'
1214942315950661632,2020-01-08 16:09:55,b'Mango and Old Monk Trifle: #ScrollFood recipe by @eatanddust https://t.co/EVnGbT6obe\n\nThe king of fruits \xe2\x80\x93 mango \xe2\x80\x93\xe2\x80\xa6 https://t.co/CZQuAQ9agz'
1214937303447199744,2020-01-08 15:50:00,b'\xe2\x80\x98The resistance (to NRC) is increasing across the country and the government needs to rethink its approach.\xe2\x80\x99 https://t.co/Qo10NMBovK'
1214936951846920192,2020-01-08 15:48:36,b'Take a look at the biggest stories of the day.  https://t.co/mLtvYaR3Go'
1214936572765691905,2020-01-08 15:47:06,"b'Recep Tayyip Erdogan says, \xe2\x80\x9cno one has the right to throw whole region, especially Iraq, into a new ring of fire fo\xe2\x80\xa6 https://t.co/4y0b1iepYq'"
1214936315013160960,2020-01-08 15:46:04,"b'\xe2\x80\x9cAmerica thought that they could create division in Iraq by killing General Soleimani, but on the contrary, Iraq be\xe2\x80\xa6 https://t.co/b8DqQrc6Vw'"
1214936144648888327,2020-01-08 15:45:23,b'Rouhani also praises the Iraqi Parliament for demanding the withdrawal of US troops from the country. He says the p\xe2\x80\xa6 https://t.co/SNLPCjrLCm'
1214936142757257217,2020-01-08 15:45:23,b'Iranian President Rouhani says that US has committed a grave mistake by killing Soleimani. \xe2\x80\x9cIf General Soleimani wi\xe2\x80\xa6 https://t.co/97hVE1pCWj'
1214936140785958912,2020-01-08 15:45:23,b'The Iranian envoy to India has assured that the Chabahar Port project will go on. \n\n\xe2\x80\x9cChabahar Port is a symbol of v\xe2\x80\xa6 https://t.co/FNQHem9lPH'
1214935349685714945,2020-01-08 15:42:14,"b'RT @thefield_in: #RanjiTrophy\n\nTamil Nadu named a strong team for matches against Mumbai, Railways.\n\nhttps://t.co/URohuh8Lqm'"
1214934917009657856,2020-01-08 15:40:31,b'UN mission in Iraq says that the country should not be made to \xe2\x80\x9cpay the price\xe2\x80\x9d for tensions between Iran and the US\xe2\x80\xa6 https://t.co/ff4I1BGt0g'
1214934914887344128,2020-01-08 15:40:30,"b'United States President Donald Trump will address the country at 11 pm local time (9.30 pm Indian Standard Time), A\xe2\x80\xa6 https://t.co/Yf4KuiA2gA'"
1214932270894796802,2020-01-08 15:30:00,"b'The last decade was India\xe2\x80\x99s hottest on record, 2019 was seventh warmest year: IMD https://t.co/YgqHAJKlRx'"
1214928180839997445,2020-01-08 15:13:45,"b'India\xe2\x80\x99s Directorate General of Civil Aviation has said that in view of the tension in West Asia, all airlines shoul\xe2\x80\xa6 https://t.co/W8fXFp4Hn5'"
1214927237155151874,2020-01-08 15:10:00,b'#JNUAttack: Watch demonstrations in Lahore in solidarity with Indian students\nhttps://t.co/aQmMlzHd6B'
1214926384457322496,2020-01-08 15:06:36,"b'Kumar also took a dig at actor #DeepikaPadukone, who visited the JNU campus on Tuesday evening. https://t.co/Vabqchacsm'"
1214926289905188865,2020-01-08 15:06:14,b'JNU vice chancellor briefs HRD ministry officials about steps taken to restore normalcy on campus https://t.co/Vabqchacsm'
1214922203893944320,2020-01-08 14:50:00,"b'\xe2\x80\x98I was slapped, called a Pakistani\xe2\x80\x99: Activist #SadafJafar recalls assault in UP Police custody https://t.co/Fef2Wmj4t9'"
1214921620000608256,2020-01-08 14:47:41,b'RT @thefield_in: #INDvSL \n\nAverage speed over 140 kph.\n\nFastest ball over 150 kph.\n\nHow good was #NavdeepSaini against Sri Lanka in Indore?\xe2\x80\xa6'
1214919511716950018,2020-01-08 14:39:18,"b'#DeepikaPadukone should not be criticised for visiting JNU, says Union minister Prakash Javadekar\nhttps://t.co/0Le2vfpRhK'"
1214919329306726401,2020-01-08 14:38:34,b'RT @thefield_in: #ILeague #TRAUNFC #AFCCB \n\nTRAU jumped to the ninth spot in the table after being rooted to the bottom for most part of th\xe2\x80\xa6'
1214917171865718785,2020-01-08 14:30:00,b'What Australia\xe2\x80\x99s bushfires mean for the country\xe2\x80\x99s most enduring tourism icon \xe2\x80\x93 the #Koala https://t.co/x0coxnnMZW'
1214916065668452352,2020-01-08 14:25:36,"b'RT @thefield_in: #MCIMUN \n\nLook away, Manchester United fans.\n\nhttps://t.co/Q5oxLUNeNE'"
1214912504993681408,2020-01-08 14:11:27,"b'RT @thefield_in: \xe2\x80\x9c@klrahul11 is in unbelievable form"": Gautam Gambhir\n\nREAD: https://t.co/TZb1vn58r7'"
1214912137644036096,2020-01-08 14:10:00,b'The government\xe2\x80\x99s Citizenship Amendment Act outreach event in Mumbai on Sunday was a low-key affair. https://t.co/nnHKiZog1C'
1214908339160633344,2020-01-08 13:54:54,b'Electoral bond scheme: CIC orders Centre to reveal names of donors who want to remain anonymous https://t.co/4OGBIDxzys'
1214907104391286786,2020-01-08 13:50:00,"b'As protests across the CAA-NRC rage across India, @deepikapadukone on Tuesday became the biggest Bollywood name to\xe2\x80\xa6 https://t.co/wLgJyEieoB'"
1214906480446435328,2020-01-08 13:47:31,"b'RT @thefield_in: #FCGNEU \n\nSpecial match for FC Goa as they play their 100th game, becoming the first #ISL team to do so.\n\nThe Gaurs face N\xe2\x80\xa6'"
1214905286026121216,2020-01-08 13:42:46,"b""RT @thefield_in: #MalaysiaMastersSuper500 \n\nWorld No 1 Zheng Si Wei and Huang Ya Qiong defeat India's Sikki Reddy and Pranaav Jerry Chopra\xe2\x80\xa6"""
1214902890776547328,2020-01-08 13:33:15,"b'#BharatBandh: Violence reported from across West Bengal, Mamata Banerjee accuses Left of hooliganism https://t.co/1cqDtQIWwc'"
1214902830995165184,2020-01-08 13:33:01,"b""RT @thefield_in: Do you know the story behind @benstokes38's folded-finger celebration?\n\nIt's awe inspiring. \n\nREAD: https://t.co/Ebc8XOKX1L"""
1214902071159189505,2020-01-08 13:30:00,b'Watch: Indian \xe2\x80\x98Spy Princess\xe2\x80\x99 Noor Inayat Khan and Ada Lovelace appear in latest #DoctorWho episode\nhttps://t.co/rwT1BkGX4s'
1214898668353937412,2020-01-08 13:16:28,b'Union minister V Muraleedharan says the govt is closely monitoring the developments in the Gulf region. He says tha\xe2\x80\xa6 https://t.co/G23mSpqv1M'
1214898665812152320,2020-01-08 13:16:28,"b'Flights of Air India, Air India Express that usually fly over Iran have now been rerouted, a flight spokesperson te\xe2\x80\xa6 https://t.co/V7f34VD9rY'"
1214898663178174464,2020-01-08 13:16:27,b'German airline Lufthansa has said it will not flying over Iran and Iraq. \xe2\x80\x9cWe are no longer overflying Iran and Iraq\xe2\x80\xa6 https://t.co/lYg4F4N7Uc'
1214898660086992899,2020-01-08 13:16:26,b'Security outside the United States consulate in Hyderabad has been increased amid escalating tensions between the U\xe2\x80\xa6 https://t.co/hm6qjV6gGC'
1214898657725571074,2020-01-08 13:16:26,b'Chengeni says Iran is not in favour of war and has been looking for peace and prosperity for everyone in the region\xe2\x80\xa6 https://t.co/s2PfeMDqa3'
1214897845813141504,2020-01-08 13:13:12,"b'\xe2\x80\x9cIndia belongs to this region. We welcome all initiatives from all countries, especially India as a good friend for\xe2\x80\xa6 https://t.co/vm0t5CEJeE'"
1214897843661488128,2020-01-08 13:13:12,b'Iran\xe2\x80\x99s envoy to India Ali Chengeni says the country will welcome any peace initiative by India to help in des-escal\xe2\x80\xa6 https://t.co/VCSPVndRho'
1214897038070034433,2020-01-08 13:10:00,b'Watch: The moment when Iran launched missiles targeting US bases in Iraq\nhttps://t.co/EdgZdBcZpA'
1214895935752265728,2020-01-08 13:05:37,"b'RT @thefield_in: #MalaysiaMastersSuper500 \n\n- @Pvsindhu1, @NSaina cruise into 2nd round.\n\n- Superb wins for @PRANNOYHSPRI, @sameerv2210 ove\xe2\x80\xa6'"
1214894846705426432,2020-01-08 13:01:17,"b'@VijaytaL \xe2\x80\x98A mob was at our door in 5 minutes\xe2\x80\x99: #SuryaRajappan, evicted from her Delhi house for opposing CAA\xe2\x80\xa6 https://t.co/5wYHNmwPbT'"
1214893088566460420,2020-01-08 12:54:18,"b'Give @BhimArmyChief immediate medical treatment, Delhi court directs Tihar Jail authorities\nhttps://t.co/02XyprVXbT'"
1214892005202907136,2020-01-08 12:50:00,"b'From Amit Shah\xe2\x80\x99s \xe2\x80\x98Netflix\xe2\x80\x99 missed call campaign to Bollywood meetings, BJP is hoping to change the narrative on the\xe2\x80\xa6 https://t.co/bvSN8lRpKv'"
1214889610486022149,2020-01-08 12:40:29,"b'RT @thefield_in: #IndianFootball #ILeague\n\nGokulam Kerala face Chennai City in clash of heavyweights, Mohun Bagan seek fourth straight vict\xe2\x80\xa6'"
1214888070522134529,2020-01-08 12:34:22,"b""RT @thefield_in: #MalaysiaMastersSuper500 \n\nNow it is Sameer Verma's turn to upset a higher-ranked player. The Indian defeats Kantaphon Wan\xe2\x80\xa6"""
1214886972214243329,2020-01-08 12:30:00,b'Citizenship Act: BJP releases video drumming up Bollywood support for the new legislation\nhttps://t.co/WaVMLEQvtZ'
1214886846657773568,2020-01-08 12:29:30,b'Srinagar: Clashes erupt in #Nowgam after 16-year-old boy gets run over by police vehicle\nhttps://t.co/LLzEMbzoMM'
1214886237720338432,2020-01-08 12:27:05,"b'#Jharkhand: Sedition charges filed against over 3,000 anti-Citizenship Act protestors in Dhanbad https://t.co/dzQ18vf24l'"
1214885869066129409,2020-01-08 12:25:37,b'RT @thefield_in: #IndianTennis \n\nIndia\xe2\x80\x99s WTA No 1 @Ankita_champ Raina started her 2020 season with a win\n\nREAD: https://t.co/hG1HEXqc3f'
1214884919551217665,2020-01-08 12:21:50,b'NRC like an arranged marriage? @chetan_bhagat\xe2\x80\x99s new analogy is hailed by critics of the plan https://t.co/oySu5vn03e'
1214881938567155718,2020-01-08 12:10:00,b'He died escaping CRPF on the day Kashmir lost special status. Police finally admit to his death\xe2\x80\xa6 https://t.co/2dE8QSF3XA'
1214876905398308864,2020-01-08 11:50:00,b'The country cannot be ruled by a party whose sole strategy consists of lighting fires so it can shift through the a\xe2\x80\xa6 https://t.co/y7XPci3u5N'
1214871872577396737,2020-01-08 11:30:00,"b'In a bid to #BoycottChhapaak, many trolls tweet cancelled movie tickets \xe2\x80\x93 for exactly the same seats\xe2\x80\xa6 https://t.co/VNCwNJmvsi'"
1214869603639103488,2020-01-08 11:20:59,"b'.@VijaytaL in conversation with Surya Rajappan, the Delhi woman who was evicted from her house for protesting again\xe2\x80\xa6 https://t.co/OlgQHZBTxV'"
1214866839085281280,2020-01-08 11:10:00,"b'ICC Test rankings: Kohli regains top spot in batting list, Pujara and Rahane slip https://t.co/rbm5nsmZRY (via @thefield_in)'"
1214865232222310400,2020-01-08 11:03:37,"b'RT @thefield_in: #TestCricket \n\n""Clearly, most teams aren\'t good enough. Save five-days for matches between good teams""\n\nJoin the #Debate o\xe2\x80\xa6'"
1214861805803016193,2020-01-08 10:50:00,b'The group was part of a door-to-door campaign being led by Home Minister Amit Shah in Lajpat Nagar and turned viole\xe2\x80\xa6 https://t.co/pXCe8Ve0KC'
1214860666315526146,2020-01-08 10:45:28,"b'RT @thefield_in: #BBL09 \n\nOne day, two hat-tricks in the Big Bash League.\n\nWATCH: https://t.co/fSqjVsjFPP'"
1214860065628286976,2020-01-08 10:43:05,b'RT @TheReel_in: Why Deepika Padukone\xe2\x80\x99s JNU visit matters\n\nhttps://t.co/Iou9JRhcWr https://t.co/aIEfC7oX0G'
1214860052286205954,2020-01-08 10:43:02,"b'RT @TheReel_in: In a bid to #BoycottChhapaak, many trolls tweet cancelled movie tickets \xe2\x80\x93 for exactly the same seats https://t.co/eL4cdee89\xe2\x80\xa6'"
1214858790677254144,2020-01-08 10:38:01,b'Take a look at the biggest stories of the day. https://t.co/1SncWkdOwY'
1214856773489827841,2020-01-08 10:30:00,b'Mumbai beef trader attacked by cow vigilantes in 2014 gets refugee status in Canada https://t.co/B4Eih8Z0Ra'
1214852481567485952,2020-01-08 10:12:57,"b'RT @thefield_in: #ICCRankings \n\nPujara was placed sixth, down one rung while Rahane occupied the ninth spot after slipping a couple of posi\xe2\x80\xa6'"
1214851991245115393,2020-01-08 10:11:00,b'The idea of four-day Tests has left the cricketing world divided. Which side of the debate are you on?\xe2\x80\xa6 https://t.co/bWLFY1HoUq'
1214847808622120961,2020-01-08 09:54:23,b'RT @thefield_in: #Cricket #FourDayTests \n\nThe idea of four-day Tests has left the cricketing world divided. Which side of the debate are yo\xe2\x80\xa6'
1214847641701404674,2020-01-08 09:53:43,"b'Also read,\n\nHere\xe2\x80\x99s what an Iran-US conflict would mean for India https://t.co/QOL2syQd7o #IranAttacks'"
1214847494451941376,2020-01-08 09:53:08,b'#LIVE | A man holds a shrapnel from a missile launched by Iran on United States-led coalition forces on the outskir\xe2\x80\xa6 https://t.co/PLYHPIKl19'
1214847354739625984,2020-01-08 09:52:34,"b'Iranian President Hassan Rouhani will deliver a speech later in the day, according to the state television. \n\nFollo\xe2\x80\xa6 https://t.co/8mEVeSc9W9'"
1214847235311030273,2020-01-08 09:52:06,b'Iranian state television claims that at least 80 \xe2\x80\x9cAmerican terrorists\xe2\x80\x9d have been killed after Tehran fired 15 missi\xe2\x80\xa6 https://t.co/AdUsPBULfU'
1214847062405079041,2020-01-08 09:51:25,b'\xe2\x80\x9cSoleimani\xe2\x80\x99s death has revived our revolution. It has shown the world that our resistance is still alive. Last nigh\xe2\x80\xa6 https://t.co/qq6XagkebQ'
1214847060014297088,2020-01-08 09:51:24,b'Iran\xe2\x80\x99s Supreme Leader Ayatollah Khamenei says assassinated General Qasem Soleimani had foiled many \xe2\x80\x9cillegitimate pl\xe2\x80\xa6 https://t.co/Mmi2Utjq6L'
1214847057803894784,2020-01-08 09:51:24,b'Punjab Chief Minister @capt_amarinder urges PM Narendra Modi to be ready with a plan of safety and security of arou\xe2\x80\xa6 https://t.co/HR5eKs8nQ0'
1214847054238773250,2020-01-08 09:51:23,"b'People celebrate after Iran launched missiles at US-led forces in Iraq, in Tehran. \n\nFollow live updates here:\xe2\x80\xa6 https://t.co/qsmXtnwKf1'"
1214846958046715909,2020-01-08 09:51:00,b'Here\xe2\x80\x99s what an Iran-US conflict would mean for India\n\nhttps://t.co/QOL2sz7OvY #Replug https://t.co/zKfx9B8Mss'
1214845874091646976,2020-01-08 09:46:41,"b'#Muzaffarpur shelter home case: No evidence of murder of children, CBI tells Supreme Court https://t.co/AwFy8ARseD'"
1214844279161413632,2020-01-08 09:40:21,"b'""A Case of Exploding Mangoes has been in publication for 11 years now. Nobody has ever bothered me. Why now?""\n\nhttps://t.co/Iz30CxforC'"
1214841925267861504,2020-01-08 09:31:00,b'What will you see if you visit the precise point where India ends and Sri Lanka begins?\n\nhttps://t.co/0UbDAF2wsl\xe2\x80\xa6 https://t.co/Xxz0qc3SGK'
1214839130686836737,2020-01-08 09:19:54,b'RT @thefield_in: Chris Green was picked up by Kolkata Knight Riders in the #IPLAuction but a ban for illegal bowling action raises question\xe2\x80\xa6'
1214836891683409920,2020-01-08 09:11:00,b'Watch this hilarious Bollywood spoof on the CAA-NRC featuring Aamir Khan (without his knowledge)\n\nhttps://t.co/gVu4m1BnhP'
1214834438422482944,2020-01-08 09:01:15,"b""RT @thefield_in: #INDvSL \n\nIn the form that he is in, is KL Rahul an automatic pick in India's T20I XI for you?\n\nREAD: https://t.co/UsFwjOi\xe2\x80\xa6"""
1214831858510389248,2020-01-08 08:51:00,b'\xe2\x80\x98They will come at you with any number of weapons\xe2\x80\x99: Anurag Kashyap on the government\n\nhttps://t.co/jxizafXqVq'
1214827117436751872,2020-01-08 08:32:09,"b'The last decade was India\xe2\x80\x99s hottest on record, 2019 was seventh warmest year: IMD\n\nhttps://t.co/YgqHAJsKsX https://t.co/QpszbOFBIJ'"
1214824308746473473,2020-01-08 08:21:00,"b'NSFW: In polarised India, should you talk politics with your colleagues?\n\nhttps://t.co/S23vmIPm4Y https://t.co/VEnJGIFQnM'"
1214821792340041728,2020-01-08 08:11:00,b'\xe2\x80\x98Blood or colour\xe2\x80\x99 on Aishe Ghosh\xe2\x80\x99s head: West Bengal BJP chief Dilip Ghosh calls JNU violence staged\xe2\x80\xa6 https://t.co/PBHL5WBOGF'
1214820693663047682,2020-01-08 08:06:38,"b""RT @thefield_in: Did you know the story behind Ben Stokes's folded-finger gesture? \n\nIt's a tribute to his father. \n\nRead more here: https:\xe2\x80\xa6"""
1214819751697891330,2020-01-08 08:02:53,b'Establishment-friendly news anchor Anjana Om Kashyap says CAA and NRC can be a \xe2\x80\x98lethal combination\xe2\x80\x99\n\nhttps://t.co/Qo10NMjN7a'
1214817007012442112,2020-01-08 07:51:59,"b'JNU violence: Chidambaram demands vice chancellor\xe2\x80\x99s resignation, asks him to \xe2\x80\x98follow his own advice\xe2\x80\x99\xe2\x80\xa6 https://t.co/Vgx8qqz4tn'"
1214814796001861632,2020-01-08 07:43:12,b'Bharat bandh: Rahul Gandhi lends support to trade unions; some vandalism reported in Bengal\n\nhttps://t.co/1cqDtQIWwc https://t.co/WjdWadmjdR'
1214814671808499712,2020-01-08 07:42:42,b'The board said that even consumption of beef can put a person\xe2\x80\x99s life at risk of \xe2\x80\x9cviolent retribution by these radic\xe2\x80\xa6 https://t.co/kPMWuld5uy'
1214811879006035968,2020-01-08 07:31:36,b'How do Crazy Rich Indians holiday? They rent Ronaldo\xe2\x80\x99s yacht or ask Coldplay to sing their playlist\xe2\x80\xa6 https://t.co/ZlVsNcZi3P'
1214806692736753664,2020-01-08 07:11:00,b'A tale of two states: Why disaster recovery in India needs to go beyond housing\n\nhttps://t.co/DL0Sws8PUT https://t.co/czgDoQZ0k2'
1214804103068471297,2020-01-08 07:00:42,b'Indian shuttlers\xe2\x80\x99 poor run at the Malaysia Masters badminton tournament in Kuala Lumpur continues.\xe2\x80\xa6 https://t.co/J78kBVUoJA'
