id,created_at,text
1210900705579540480,2019-12-28 12:30:00,b'The enigmatic life and times of VK Krishna Menon are resurrected in this biography by Jairam Ramesh https://t.co/3OHBky6mFE'
1210895672070823936,2019-12-28 12:10:00,"b'How Assam is dealing with social media dissent against CAA: Official orders, \xe2\x80\x98polite\xe2\x80\x99 calls https://t.co/AW88vcJIhv\xe2\x80\xa6 https://t.co/9gb8E9jwyF'"
1210891170391285761,2019-12-28 11:52:06,b'Editors Guild condemns BJP IT Cell head\xe2\x80\x99s \xe2\x80\x98McCarthyist\xe2\x80\x99 social media poll against @sardesairajdeep \nhttps://t.co/ndt295gc7C'
1210890639212072960,2019-12-28 11:50:00,"b'Watch: A bull decided to interrupt a BJP rally in Siliguri, West Bengal\nhttps://t.co/Qy0Zf1EfyX'"
1210888817227395073,2019-12-28 11:42:45,b'Join the #ScrollFood community on:\n\nFacebook: https://t.co/5UfvBlPMN6\nInstagram: https://t.co/Rywo1GVrTH https://t.co/5UQCsP3R0J'
1210888803889532929,2019-12-28 11:42:42,b'Follow these steps to contribute to #ScrollFood.\nhttps://t.co/twO9F6pKUW'
1210888801712631808,2019-12-28 11:42:42,b'#ScrollFood | We are building the biggest encyclopedia of recipes in India. Be a part of our journey. https://t.co/riocwRKtcx'
1210888799099576321,2019-12-28 11:42:41,b'Chai Cupcakes With Chai Buttercream Frosting: #ScrollFood recipe by @poojadhingraa https://t.co/pI0vlKPNKD\n\nIndia\xe2\x80\x99s\xe2\x80\xa6 https://t.co/O0YlTnJ8K3'
1210886503846432768,2019-12-28 11:33:34,b'RT @TheReel_in: When Ashutosh Gowariker taught Shah Rukh Khan the value of detail https://t.co/v3FvblarMY [Replug] https://t.co/ywoLwvmuXU'
1210885606336843777,2019-12-28 11:30:00,"b'Despite BJP\xe2\x80\x99s attempts to delink NPR-NRC and Citizenship Act, it is clear that all three are inextricably connected\xe2\x80\xa6 https://t.co/cxMAmUt7om'"
1210883089045569537,2019-12-28 11:20:00,b'Your support is crucial: India needs independent media and independent media needs you. https://t.co/ugkYiHZRUa https://t.co/g4pnc5rajN'
1210882113441955841,2019-12-28 11:16:07,b'A video clip of a man trying to protect his three-year-old daughter from the police in Mangaluru has gone viral on\xe2\x80\xa6 https://t.co/xoS3kjhYYu'
1210882111315402755,2019-12-28 11:16:07,"b'#CAAProtests: Victims narrate incidents of police brutality in Lucknow, Mangaluru https://t.co/O9v3vHyTbK'"
1210880572459012096,2019-12-28 11:10:00,"b'As 2019 ends, listen Begum Akhtar, Gauhar Jaan and other greats sing thumri \xe2\x80\x98Ras ke Bhare Tore\xe2\x80\x99 https://t.co/6Syj6MV8XJ'"
1210876928107806721,2019-12-28 10:55:31,b'RT @NicolaiNayak: National team call-up incoming? \xf0\x9f\x87\xae\xf0\x9f\x87\xb3\xe2\x9a\xbd\xef\xb8\x8f\n\nMy piece on \xe2\x81\xa6@FCGoaOfficial\xe2\x81\xa9\xe2\x80\x99s silent assassin. https://t.co/Cnf3XICm6R'
1210875539340152832,2019-12-28 10:50:00,b'What #Mumbai\xe2\x80\x99s history of mass protest reveals about its citizens https://t.co/SUPmFxbyak | @KapadiaAparna'
1210873991247712257,2019-12-28 10:43:51,"b""Here's what we know: https://t.co/wBGCMx2b2b"""
1210873988404006912,2019-12-28 10:43:50,"b'However, a fact-finding report had found that police officials fired stun grenades, \xe2\x80\x9cusually used in war-like situa\xe2\x80\xa6 https://t.co/rO4mnvKI96'"
1210872086513610755,2019-12-28 10:36:16,"b'#AMUProtests: Police register case against 10,000 unidentified students in December 15 violence\nhttps://t.co/wBGCMx2b2b'"
1210870757884125186,2019-12-28 10:31:00,"b'\xe2\x80\x98I don\xe2\x80\x99t know what\xe2\x80\x99s happened in the last three to four years that, like a crop rises again, these words have risen\xe2\x80\xa6 https://t.co/QHt1D9I5kb'"
1210870380644065286,2019-12-28 10:29:30,"b'RT @RohanV: First Amit Shah promised NRC + Citizenship Act, ""aap chronology samajhiye.""\nThen BJP said there\'s no link.\nThen Modi said we di\xe2\x80\xa6'"
1210865724610293761,2019-12-28 10:11:00,b'Watch: \xe2\x80\x98Andolan\xe2\x80\x99 is a no-holds-barred CAA protest song by Naqaab47 and Shoals\n\nhttps://t.co/QlythJ8bwy'
1210861263657541632,2019-12-28 09:53:16,b'Finance minister bans levy of Merchant Discount Rate by businesses with turnover of over Rs 50 crore https://t.co/S031d4ZqdJ'
1210860691449507840,2019-12-28 09:51:00,b'\xe2\x80\x98Are we fighting a war on the border?\xe2\x80\x99 Actor Swara Bhaskar question the actions of UP Police\n\nhttps://t.co/wqHekAYxYl'
1210855658440069122,2019-12-28 09:31:00,"b'\xe2\x80\x98If the idea of India doesn\xe2\x80\x99t allow me to come out on the street as a Muslim, I reject this idea\xe2\x80\x99\n\nhttps://t.co/sMZTGS83EK'"
1210850625157644288,2019-12-28 09:11:00,"b'\xe2\x80\x98Notebandi, 15 lakhs in bank and achhe din to my country\xe2\x80\x99: Watch this updated \xe2\x80\x9812 days of Christmas\xe2\x80\x99\n\nhttps://t.co/XT4c4z3kto'"
1210845592017985536,2019-12-28 08:51:00,b'That guilty look and other assumptions humans make about dog\xe2\x80\x99s feelings\n\nhttps://t.co/TgrOSoXPwn https://t.co/eqgmKwMVLy'
1210845386581000192,2019-12-28 08:50:11,b'Join the #ScrollFood community on:\n\nFacebook: https://t.co/5UfvBlPMN6\nInstagram: https://t.co/Rywo1GVrTH https://t.co/qZfCxcqv4a'
1210845364846120960,2019-12-28 08:50:06,b'Follow these steps to contribute to #ScrollFood.\nhttps://t.co/twO9F6pKUW https://t.co/x6VuJ27zJX'
1210845357678055424,2019-12-28 08:50:04,b'#ScrollFood | We are building the biggest encyclopedia of recipes in India. Be a part of our journey.\xe2\x80\xa6 https://t.co/7TorRG19eN'
1210845346865147904,2019-12-28 08:50:01,b'Deomali: #ScrollFood recipe by Chef Amninder Sandhu\n\nhttps://t.co/1e7Ql68KAU\n\nBamboo-smoked meat with slightly swee\xe2\x80\xa6 https://t.co/zQqBuBjGDB'
1210840558899515392,2019-12-28 08:31:00,b'Picture the song: \xe2\x80\x98Vivaha Bhojanambu\xe2\x80\x99 from \xe2\x80\x98Mayabazar\xe2\x80\x99 is a delicious tribute to gluttony\n\nhttps://t.co/qKtHAFqHSM https://t.co/wQcqUqV0uj'
1210840402703474690,2019-12-28 08:30:22,b'A look at the headlines right now.\n\nhttps://t.co/zmFIurem7E'
1210840318657957888,2019-12-28 08:30:02,"b'Thailand cave incident: Navy officer dies of infection he got while rescuing 12 boys, football coach\xe2\x80\xa6 https://t.co/EfXtR8F5wA'"
1210837649092534273,2019-12-28 08:19:26,b'Boxing: Mary Kom beats Nikhat Zareen in 51 kg trial to make Indian team for Olympic qualifiers\xe2\x80\xa6 https://t.co/7sF4F4u1AK'
1210835525684383745,2019-12-28 08:11:00,"b""From 'hounds' to 'pompous asses': How Indian PR folks describe Indian journalists\n\nhttps://t.co/nUqJdtYsa0 https://t.co/PTbghA9YMk"""
1210835482524831745,2019-12-28 08:10:49,"b""RT @thefield_in: #IndianFootball \n\nFrom rookie winger to now a top-class full-back, @FCGoaOfficial's Seriton Fernandes is making a strong c\xe2\x80\xa6"""
1210833640327827456,2019-12-28 08:03:30,"b'RT @thefield_in: #Boxing \n\nIn a bout that had very few clear punches, @MangteC Mary Kom prevailed 9-1 against  Nikhat Zareen\n\nReport: https\xe2\x80\xa6'"
1210830492511002627,2019-12-28 07:51:00,b'This animated video on the history of the English language will have you laughing as you learn\n\nhttps://t.co/5djJXWlvjM'
1210829634134142976,2019-12-28 07:47:35,"b'""Here is the Tihar returned great man who, for the sake of a position, is seeking to please the Italian woman by se\xe2\x80\xa6 https://t.co/1gPeJGs8rr'"
1210825459526590464,2019-12-28 07:31:00,b'\xe2\x80\x98Find Me\xe2\x80\x99: Andr\xc3\xa9 Aciman\xe2\x80\x99s sequel to \xe2\x80\x98Call Me By Your Name\xe2\x80\x99 is not here to mend anyone\xe2\x80\x99s broken heart\xe2\x80\xa6 https://t.co/YhBFxlWEiS'
1210820511791341568,2019-12-28 07:11:20,b'RT @thefield_in: JUST IN:\n\nMary Kom beats Nikhat Zareen in the final of the 51 kg boxing trials.\nThe veteran will represent India in the Ol\xe2\x80\xa6'
1210820426110160898,2019-12-28 07:11:00,b'How history has systematically distorted the figure of Shivaji\n\nhttps://t.co/Rbj8PIzTlc https://t.co/QdgDtpZblE'
1210817005986537473,2019-12-28 06:57:24,"b'Rahul Gandhi says NPR, NRC will be more disastrous than demonetisation\n\nhttps://t.co/3tVsPoR4uz https://t.co/pna3wsB1T6'"
1210816228610101250,2019-12-28 06:54:19,"b""A short recorded history of the contentious national song 'Vande Mataram'\n\nhttps://t.co/WOvH2LMBGi #Archives https://t.co/PCAZNoX0Z8"""
1210810359830863872,2019-12-28 06:31:00,b'Watch: Rahul Gandhi dances on stage alongside Chhattisgarh\xe2\x80\x99s tribal dancers\n\nhttps://t.co/SDYqF8biZv'
1210805939961393153,2019-12-28 06:13:26,b'The constables in the video have been identified as Mahesh Yadav and Sanjay Pathak.\n\nhttps://t.co/nf65CKsiGJ'
1210805326670204928,2019-12-28 06:11:00,b'The backstory: Intercaste love often ends in death. But what happens when the couple survives?\xe2\x80\xa6 https://t.co/IP4lu3Ez6L'
1210796010127032321,2019-12-28 05:33:58,"b'""Where will you go? I will set this lane right now that you have given me this chance"": Akhilesh Narayan Singh\n\nhttps://t.co/HEzWD7a5Aa'"
1210795260495876097,2019-12-28 05:31:00,"b'ISL, Kerala Blasters vs NorthEast United preview: Schattorie eyes vital win as he faces former club\xe2\x80\xa6 https://t.co/lN2V2uKYYi'"
1210790227121451008,2019-12-28 05:11:00,"b'A decade in Indian football: Fluctuating Fifa ranking, lack of new goalscorers and two Asian Cups\xe2\x80\xa6 https://t.co/9d51cmAzUy'"
1210785194069807108,2019-12-28 04:51:00,b'Bollywood music 2019: \xe2\x80\x98Kalank\xe2\x80\x99 title track and \xe2\x80\x98Bekhayali\xe2\x80\x99 from \xe2\x80\x98Kabir Singh\xe2\x80\x99 among the best songs\xe2\x80\xa6 https://t.co/KeHBwmYvkZ'
1210782419437019141,2019-12-28 04:39:58,"b""RT @KasualShukla: India had 37 different scorers in the last decade, 18 out of which scored just once. 52% of India's goals in the last ten\xe2\x80\xa6"""
1210781921896099841,2019-12-28 04:38:00,"b'The weather department in its bulletin said Punjab, Haryana, Chandigarh and Uttar Pradesh are also likely to experi\xe2\x80\xa6 https://t.co/SxpICxY4OB'"
1210780160921886720,2019-12-28 04:31:00,b'Watch: Powerpuff Girls turn into Citizenship Act protesters in this video edit\n\nhttps://t.co/1ZAxCZHUNM'
1210775127694004224,2019-12-28 04:11:00,b'Watch: This poem conveys the fear instilled by the amended Citizenship Act\n\nhttps://t.co/8xdtFjMwxD'
1210775018646302725,2019-12-28 04:10:34,"b'""Are revolutionaries being taught or understood as terrorists in MP?"": Shivraj Singh Chouhan\n\nhttps://t.co/1TMrqB3H0p'"
1210773844769693702,2019-12-28 04:05:54,"b'RT @thefield_in: Fluctuating Fifa ranking, lack of new goalscorers and two Asian Cup campaigns\n\n@KasualShukla looks at some key numbers and\xe2\x80\xa6'"
1210771743209447430,2019-12-28 03:57:33,b'RT @thefield_in: \xe2\x80\x9cI\xe2\x80\x99ll fight together with my teammates to change the course of this season. I will do everything to make it happen.\xe2\x80\x9d\n\n@Ibr\xe2\x80\xa6'
1210770094852198402,2019-12-28 03:51:00,"b'How Assam is dealing with social media dissent against CAA: Official orders, \xe2\x80\x98polite\xe2\x80\x99 calls\xe2\x80\xa6 https://t.co/msf5JI4Nm2'"
1210766464518483970,2019-12-28 03:36:34,"b""RT @thefield_in: #WOLMCI \n\nManchester City's title defence is all but over after Wolves complete the double over the Premier League champio\xe2\x80\xa6"""
1210765061368795136,2019-12-28 03:31:00,b'The enigmatic life and times of VK Krishna Menon are resurrected in this biography by Jairam Ramesh\xe2\x80\xa6 https://t.co/zUYwRq0aox'
1210762691414904832,2019-12-28 03:21:35,b'A look at the headlines right now.\n\nhttps://t.co/vi9IZbo09f'
1210762518928379906,2019-12-28 03:20:54,"b'Armed forces have utmost respect for human rights, driven by \xe2\x80\x98insaniyat, sharafat\xe2\x80\x99: Army chief\xe2\x80\xa6 https://t.co/9P2vJcX7OQ'"
1210762391014653958,2019-12-28 03:20:23,b'Citizenship Act: JDU minority cell leader tenders resignation over Nitish Kumar\xe2\x80\x99s stand\n\nhttps://t.co/0o1u6lb7sL https://t.co/VJ0m96Cc8K'
1210760028463853569,2019-12-28 03:11:00,"b'As 2019 ends, listen Begum Akhtar, Gauhar Jaan and other greats sing thumri \xe2\x80\x98Ras ke Bhare Tore\xe2\x80\x99\xe2\x80\xa6 https://t.co/jhPXN9sH6x'"
1210754995047616512,2019-12-28 02:51:00,"b'#ScrollExplainer | What is the difference between the NPR under Congress, BJP\xe2\x80\x99s NPR-NRC-CAA and the Census?\xe2\x80\xa6 https://t.co/C0cp9KSZyZ'"
1210749710727815168,2019-12-28 02:30:00,"b'With new archaeological finds, what we know about the origin of humans is changing faster than ever\nhttps://t.co/cC4l70Uilz'"
1210749003685515264,2019-12-28 02:27:11,"b'CAA protests: Adityanath justifies police crackdown in UP, says everyone has been silenced\n\nhttps://t.co/WFxwCFL5aW https://t.co/pj5Hyc230W'"
1210744677219131392,2019-12-28 02:10:00,b'\xe2\x80\x9cThis could destroy our lives forever. Is this the badla [revenge] that the chief minister was talking about?\xe2\x80\x9d \n\nNo\xe2\x80\xa6 https://t.co/eCm2LClJbL'
1210739643983040512,2019-12-28 01:50:00,"b'When the leader of the Army propagates imprudent views about a group of people, what message does this send to the\xe2\x80\xa6 https://t.co/COsileniNE'"
1210734610608463872,2019-12-28 01:30:00,"b'At Jamia, we do not distinguish between insiders and outsiders https://t.co/YsA9QU1MJ4\n\nTo many of us, the campus i\xe2\x80\xa6 https://t.co/4FExo1ux9j'"
1210729577741312006,2019-12-28 01:10:00,b'CAA protest: Citizen videos show police picking up protesters and passers-by near UP Bhawan in Delhi\xe2\x80\xa6 https://t.co/fvHelgyu9s'
1210724544496799745,2019-12-28 00:50:00,b'In charts: India shut down the internet more than 100 times in 2019 https://t.co/OwmRfhsd50 https://t.co/74CmVHe86q'
1210719512166686726,2019-12-28 00:30:00,"b'Watch: Comedian @salonayyy as \xe2\x80\x98Nazma Aapi\xe2\x80\x99 on CAA protests, water cannons, and internet shutdowns https://t.co/koU5ZPD4jx'"
1210711962381955077,2019-12-28 00:00:00,b'The spread of Islam in West Asia owes more to mixed marriages than forced conversions https://t.co/MH9zEGnMlR'
1210704412022198273,2019-12-27 23:30:00,b'History shows that those who have a lot to lose and are keen to climb the social ladder are more likely to conform. https://t.co/Qco34P2LzK'
1210696862098972674,2019-12-27 23:00:00,b'What do Obama and Trump have in common? It\xe2\x80\x99s their stance on immigrants https://t.co/eSjO92mm45'
1210689312775237632,2019-12-27 22:30:00,"b'By baring their bodies in protest, Jamia students strip Indian identity down to our basic humanity https://t.co/jZff2SZfsl'"
1210681763426529280,2019-12-27 22:00:00,b'Best Apple MacBooks in 2019: Which model should you buy? https://t.co/WjGTZk1RQZ'
1210674213490741248,2019-12-27 21:30:00,b'#DataCheck: The decade in men\xe2\x80\x99s T20I saw inconsistent West Indies shine and Kohli find consistency\xe2\x80\xa6 https://t.co/kMRbqiVmMf'
1210666665790210053,2019-12-27 21:00:00,b'Marriage at 17 blocked Samra Zafar from the life she wanted. Her book reveals how she reclaimed it https://t.co/X9DVE1rPkB'
1210659113237008384,2019-12-27 20:30:00,"b'Web series 2019: The best 10 characters, from family man Srikant Tiwari to the complex Tara Khanna\xe2\x80\xa6 https://t.co/5N3mdgNPjf'"
1210651566966894592,2019-12-27 20:00:01,b'Norwegian woman who protested against Citizenship Act forced to leave India https://t.co/GNAgFh8IwA'
1210644015458242561,2019-12-27 19:30:00,"b'Citizenship Act, NRC may affect the status of Muslims in India, says US Congress\xe2\x80\x99 think tank report https://t.co/F9BdDfbhnW'"
1210636464670703617,2019-12-27 19:00:00,b'\xe2\x80\x98Are we fighting a war on the border?\xe2\x80\x99 Actor @ReallySwara question the actions of UP Police https://t.co/wqHekAYxYl'
1210628914802053121,2019-12-27 18:30:00,"b'In India\xe2\x80\x99s Citizenship Act, an eerie echo of Nazi Germany\xe2\x80\x99s claims to protect \xe2\x80\x98racial comrades\xe2\x80\x99 https://t.co/VkP8vF580p'"
1210623881276469248,2019-12-27 18:10:00,b'Why most people fail to speak up against authoritarian regimes\nhttps://t.co/Qco34OLaIc'
1210622212463480833,2019-12-27 18:03:22,b'RT @thefield_in: #RanjiTrophy \n\nIshant Sharma finishes with an eight-wicket match haul\n\nReport: https://t.co/Td02wISa6H'
1210618847981527040,2019-12-27 17:50:00,b'Superstition runs deep. https://t.co/ljCKbY2ebJ'
1210614887639965696,2019-12-27 17:34:16,"b'Kerala is not planning to build detention centres for foreigners, says CM Pinarayi Vijayan\nhttps://t.co/keJ6Zi6YrI'"
1210614541433786368,2019-12-27 17:32:53,b'Members of the Muslim community in western Uttar Pradesh\xe2\x80\x99s Bulandshahr have reportedly handed over Rs 6 lakh to the\xe2\x80\xa6 https://t.co/bBdB0HAFFE'
1210613815014051841,2019-12-27 17:30:00,"b'On Tuesday, a team of 13 independent investigators released a fact-finding report about the AMU violence, revealing\xe2\x80\xa6 https://t.co/c0rqiK3jZi'"
1210608781752594432,2019-12-27 17:10:00,b'Data released this year showed joblessness at a 45-year high and a record number of extreme weather events. https://t.co/5MKA07VGFh'
1210608754330193920,2019-12-27 17:09:53,"b'Rahul Gandhi is liar of the year, says BJP after he dubs NPR and NRC \xe2\x80\x98tax on the poor\xe2\x80\x99 https://t.co/k6A4bwytYo'"
1210606271432232960,2019-12-27 17:00:01,"b'Advocate Rajeev Ranjan has accused Roy of offences such as breach of peace, mischief, intent to cause a riot, and c\xe2\x80\xa6 https://t.co/ShipP574ub'"
1210603748982173696,2019-12-27 16:50:00,b'Watch: How women in Bengaluru and in New Delhi\xe2\x80\x99s Shaheen Bagh are leading Citizenship Act protests https://t.co/euLmMeFexH #CAA_NRC_Protests'
1210598715486068736,2019-12-27 16:30:00,b'The power of peaceful resistance. https://t.co/hKX4s9E9IA'
1210593682300141569,2019-12-27 16:10:00,b'India\xe2\x80\x99s demand for audio content has led to a surge in the popularity of podcasts\nhttps://t.co/uHbRxELlH4 | @qzindia'
1210591035404898306,2019-12-27 15:59:29,"b'#Rajasthan: 10 infants die in Kota hospital in two days, chief minister sends investigation team https://t.co/Yypwsx2Sg1'"
1210588649097744384,2019-12-27 15:50:00,b'India leads the world in internet shutdowns by a considerable margin. https://t.co/OwmRfhJOtA | @nithya_sub'
1210587856604811267,2019-12-27 15:46:51,"b'Kerala government says it has no plans to set up detention centres for undocumented migrants, reports PTI. https://t.co/XKWhsndsA2'"
1210587854453108736,2019-12-27 15:46:50,"b'Activist Bindu Ammini, who entered the Sabarimala temple in January, was taken into custody by Delhi Police for par\xe2\x80\xa6 https://t.co/OU0EfholsJ'"
1210583615769337856,2019-12-27 15:30:00,b'Are you bad at recognising faces? It may have something to do with your personality https://t.co/SiANUbNqH8'
1210581261330202627,2019-12-27 15:20:38,b'RT @TheReel_in: \xe2\x80\x98Are we fighting a war on the border?\xe2\x80\x99 Actor @ReallySwara question the actions of UP Police https://t.co/7yiVBs4imu'
1210579741289267200,2019-12-27 15:14:36,"b'As long as I\xe2\x80\x99m alive, Citizenship Act won\xe2\x80\x99t be implemented in West Bengal, says Mamata Banerjee\nhttps://t.co/R9TqAuET1Y\n\n#CAAProtests'"
1210578582759587842,2019-12-27 15:10:00,"b'To many of us, the campus is the microcosm of a dream we call Hindustan, where everyone is allowed to just be. https://t.co/YsA9QUjnAC'"
1210573549708005376,2019-12-27 14:50:00,"b'Citizenship Act protests: VK Singh defends Bipin Rawat, says Army chief\xe2\x80\x99s remarks were not political\nhttps://t.co/Qu3AjwQBCH'"
1210572496715444230,2019-12-27 14:45:49,"b'""If there were a category of the liar of the year, he (Rahul Gandhi) would be its recipient. His comments used to e\xe2\x80\xa6 https://t.co/EhGK5AEJ7C'"
1210572492076511232,2019-12-27 14:45:48,b'Prakash Javadekar has criticised Congress leader Rahul Gandhi for saying that the NPR was a \xe2\x80\x9ctax on poor people\xe2\x80\x9d. J\xe2\x80\xa6 https://t.co/hTkgkb2JLJ'
1210569706161098753,2019-12-27 14:34:43,"b'A delegation of Samajwadi Party leaders has met Uttar Pradesh Governor Anandiben Patel, and demanded justice for \xe2\x80\x9ci\xe2\x80\xa6 https://t.co/aKL6zVbeYm'"
1210569704063897600,2019-12-27 14:34:43,"b""\xe2\x80\x9cModi is a liar,\xe2\x80\x9d Congress' Tarun Gogoi says. \xe2\x80\x9cIn 2018, the Narendra Modi government had sanctioned Rs 46 crore for\xe2\x80\xa6 https://t.co/McDDGOBFKd"""
1210568517314994176,2019-12-27 14:30:00,b'Watch: Three children were buried in cowdung during a solar eclipse in a bizarre bid to \xe2\x80\x98cure\xe2\x80\x99 them\nhttps://t.co/ljCKbY2ebJ'
1210563483407794182,2019-12-27 14:10:00,b'The increasing politicisation of the armed forces is an alarming development. https://t.co/PEqE4s3w44'
1210560760402735105,2019-12-27 13:59:11,b'The Opposition Left Front and Congress parties have taken out a rally in West Bengal\xe2\x80\x99s capital city Kolkata in prot\xe2\x80\xa6 https://t.co/vpkducx6XW'
1210560732460285954,2019-12-27 13:59:04,"b'In the rally for the Citizenship Act in Mumbai\xe2\x80\x99s August Kranti Maidan, demonstrators are carrying the tricolour and\xe2\x80\xa6 https://t.co/6ZvXWok0Gn'"
1210560681931468804,2019-12-27 13:58:52,b'Hyderabad City Police has announced that no permission has been given for any public gathering in the city on Satur\xe2\x80\xa6 https://t.co/sjmC5kNqQv'
1210560679633027073,2019-12-27 13:58:51,b'Activist and former Jawaharlal Nehru University student Umar Khalid says that there is a significant difference bet\xe2\x80\xa6 https://t.co/kynLYtase2'
1210559222477250560,2019-12-27 13:53:04,"b'Andhra government halts decision to change capital, will set up another panel to study proposal https://t.co/SszZMnsJ0R'"
1210559070530236416,2019-12-27 13:52:28,b'RT @thefield_in: #ISL #OFCJFC\n\nAction returns to Bhubaneshwar as Odisha FC face Jamshedpur FC. Both teams have been struggling of late and\xe2\x80\xa6'
1210558450188599296,2019-12-27 13:50:00,b'Marriage at 17 blocked Samra Zafar from the life she wanted. Her book reveals how she reclaimed it\nhttps://t.co/X9DVE1aet3'
1210553416952381446,2019-12-27 13:30:00,b'#GoodNewwz movie review: Akshay and Kareena deliver the goods in this comedy of errors\n\nhttps://t.co/q5pzebCBaz https://t.co/vyCdnDuOfz'
1210551961969278977,2019-12-27 13:24:13,b'Gujarat High Court upholds death penalty for man who raped and killed three-year-old Surat girl https://t.co/zqYXSrF5YC'
1210548383686938624,2019-12-27 13:10:00,"b'Shutdowns have cost the Indian economy more than $3 billion in five years, by one estimate. https://t.co/OwmRfhsd50'"
1210548186185515013,2019-12-27 13:09:13,"b'People have protested against the Citizenship Amendment Act in Andhra Pradesh\xe2\x80\x99s Vijayawada city, reports PTI.\xe2\x80\xa6 https://t.co/OTU1BjpSXW'"
1210548183320805377,2019-12-27 13:09:12,"b'Friday prayers have been completed peacefully in Uttar Pradesh amid heavy deployment of security forces, says Direc\xe2\x80\xa6 https://t.co/KbhD9QJrC2'"
1210547006151618561,2019-12-27 13:04:31,"b'Also read,\n\nNo criminal record, no protest, yet Muslim men made to sign bonds in Uttar Pradesh villages\xe2\x80\xa6 https://t.co/2kQUqy61tD'"
1210544274380451842,2019-12-27 12:53:40,b'All protestors detained at Mandir Marg police station are being released now. https://t.co/XKWhsndsA2'
1210544272107134977,2019-12-27 12:53:39,b'Mamata Banerjee reiterates that she will not implement the Citizenship Act in her state. \xe2\x80\x9cAs long as I am alive CAA\xe2\x80\xa6 https://t.co/PkTkiYsEV9'
1210543350635479040,2019-12-27 12:50:00,"b'\xe2\x80\x98If the idea of India doesn\xe2\x80\x99t allow me to come out on the street as a Muslim, I reject this idea\xe2\x80\x99 https://t.co/sMZTGS83EK'"
1210543174944313344,2019-12-27 12:49:18,b'#CAAProtests: Citizen videos show police picking up protesters and passers-by near UP Bhawan in Delhi\xe2\x80\xa6 https://t.co/T07LjVoC2c'
1210542789261324288,2019-12-27 12:47:46,b'Over 20 Indian students from various research institutes in Israel have staged a silent protest against the Citizen\xe2\x80\xa6 https://t.co/rrs2eljzNx'
1210542786555961344,2019-12-27 12:47:45,b'Four persons have been detained during protests against Citizenship Amendment Act in Gwalior district of Madhya Pra\xe2\x80\xa6 https://t.co/V2PMZkE7Bq'
1210539662931980290,2019-12-27 12:35:21,b'Chennai: Rajnath Singh pulls out of event to honour #MeToo accused #Vairamuthu\nhttps://t.co/cdKEagNh9T'
1210538317684649987,2019-12-27 12:30:00,b'The death toll stood at 28 on Friday. https://t.co/rmq98xw2CK'
1210537478957846529,2019-12-27 12:26:40,b'Violence erupted in Muzaffarnagar and 12 other districts on Friday afternoon with around 10 two-wheelers and severa\xe2\x80\xa6 https://t.co/EA56tNc8WB'
1210537475401109504,2019-12-27 12:26:39,b'Union Minister of State Sanjeev Balyan asks for an investigation on \xe2\x80\x9cwho sent children\xe2\x80\x9d to take part in protests ag\xe2\x80\xa6 https://t.co/Kru4vuETVq'
1210537471970172929,2019-12-27 12:26:38,b'Former Maharashtra Chief Minister Devendra Fadnavis reaches August Kranti Maidan in Mumbai where demonstrations are\xe2\x80\xa6 https://t.co/T6mhYathys'
1210537469470363649,2019-12-27 12:26:38,b'Leader of Opposition in the Maharashtra Assembly Fadnavis says the Citizenship Act does not strip the citizenship o\xe2\x80\xa6 https://t.co/4uMoumQKN0'
1210537467293515776,2019-12-27 12:26:37,"b'\xe2\x80\x9cThe Modi government is using the CAA, NRC and NPR as a trishul to hit the heart of the country\xe2\x80\x99s people,\xe2\x80\x9d Brinda K\xe2\x80\xa6 https://t.co/eGWfCXp8SC'"
1210537465087324160,2019-12-27 12:26:37,b'Communist Party of India (Marxist) leader Brinda Karat says the central government is using the amended citizenship\xe2\x80\xa6 https://t.co/AHm1NCfegU'
1210536176194478084,2019-12-27 12:21:29,b'CAA: Amit Shah dares Rahul Gandhi to show any provision in Act that takes away citizenship https://t.co/7YuVsDef6n #CAAProtests'
